Nombre,Frecuencia,Edad Media (*),Gender,Percentage,Popularity,Is_Compound,Character_Count,Syllable_Count,Family_Origin,Name_Description,Pronunciation_Spanish,Pronunciation_Foreign,Pronunciation_Explanation
DAVID,370270,33.7,Male,1.708058102114815,5,False,5,2,Español,"David, un nombre masculino de profundo arraigo en la cultura española, tiene su origen en el hebreo 'Dawid', cuyo significado es 'el amado' o 'el querido'. Su vasta popularidad se remonta a la figura bíblica del Rey David, el pastor que, con valentía, derrotó a Goliat y se convirtió en monarca de Israel, simbolizando así liderazgo y coraje. En España, David ha sido un nombre perenne a lo largo de los siglos, manteniendo su relevancia y atractivo. Es portado por numerosas personalidades destac...",muy fácil,muy fácil,"David' es muy fácil para españoles ya que todos sus fonemas (D, A, I) son comunes en español, y la 'V' se pronuncia como una 'B' suave, lo cual es estándar. La 'D' final es también un sonido común, a menudo suavizado. Para extranjeros (angloparlantes), aunque la 'V' española difiere de la 'V' inglesa y la 'D' final es más suave, estas son variaciones menores. Al ser un nombre internacional, su pronunciación es intuitiva y requiere mínima adaptación, haciéndolo universalmente simple."
JAVIER,308708,36.1,Male,1.4240721651434365,7,False,6,2,Español,"Javier es un nombre de origen español, derivado del término vasco Etxeberri, que significa 'casa nueva'. Su gran difusión se debe a San Francisco Javier, cofundador de la Compañía de Jesús, nacido en el Castillo de Javier en Navarra. Este influyente misionero del siglo XVI llevó el nombre por el mundo a través de sus viajes y evangelización. Entre sus variantes encontramos Xavier en inglés y francés, y la forma femenina Javiera. Es un nombre muy común en el ámbito hispanohablante, arraigado e...",muy fácil,difícil,"Para los hispanohablantes, 'Javier' es muy fácil de pronunciar, ya que todos sus fonemas son comunes e intuitivos en español, incluyendo la 'j' velar fricativa y la 'v' bilabial. Para los extranjeros, particularmente angloparlantes, resulta difícil. El principal desafío es el sonido de la 'J' española, una fricativa velar sorda que no existe en inglés y suele ser mal pronunciada como una 'j' inglesa o una 'h' suave. Aunque la 'v' se pronuncia como 'b' en español, los angloparlantes suelen usar su 'v' propia, lo cual es comprensible. No hay letras mudas."
DANIEL,304423,29.5,Male,1.4043054301458346,8,False,6,2,Español,"Daniel es un nombre de origen hebreo, Daniyyel, cuyo significado es 'Dios es mi juez' o 'Justicia de Dios'. Aunque su raíz es hebrea, se ha arraigado profundamente en la cultura española desde tiempos antiguos gracias a la figura del profeta bíblico Daniel. Este personaje del Antiguo Testamento es conocido por su sabiduría, integridad y su capacidad para interpretar sueños, así como por sobrevivir milagrosamente en el foso de los leones, lo que lo convirtió en un símbolo de fe inquebrantable....",muy fácil,muy fácil,"El nombre 'Daniel' es muy fácil de pronunciar tanto para hispanohablantes como para extranjeros. Para los españoles, todos los fonemas (D, A, N, I, E, L) son comunes en el idioma, la acentuación recae en la sílaba '-niel' de forma intuitiva y no hay letras mudas ni combinaciones fonéticas inusuales. Para los extranjeros, especialmente angloparlantes, los sonidos son prácticamente idénticos a sus equivalentes en inglés, con la salvedad de las vocales 'a', 'i' y 'e' que tienen los sonidos puros del español, lo cual no representa una dificultad significativa. Es un nombre reconocido internacionalmente."
ALEJANDRO,267256,27.8,Male,1.2328537989542685,13,False,9,4,Español,"Alejandro es un nombre masculino con un profundo arraigo en el mundo hispanohablante. Aunque su origen etimológico es griego, derivado de 'Alexandros', significa 'el protector' o 'el defensor de los hombres'. Su popularidad se disparó gracias a la figura histórica de Alejandro Magno, cuyo vasto imperio y legado cultural extendieron el nombre por muchas regiones. En España y Latinoamérica, Alejandro ha sido un nombre constantemente elegido, evocando cualidades de fuerza, liderazgo y nobleza. E...",muy fácil,difícil,"Para españoles, la pronunciación de 'Alejandro' es muy fácil. Todos sus fonemas son comunes en el español (la 'j' y la 'r' simple son sonidos habituales), no hay letras mudas ni combinaciones inusuales. Para extranjeros (angloparlantes), es difícil. El sonido de la 'j' española es un desafío significativo, ya que no tiene un equivalente directo en inglés (es un sonido gutural). La 'r' simple (tap) también difiere de la 'r' retrofleja inglesa, requiriendo práctica. Aunque la escritura es intuitiva, estos sonidos específicos elevan la dificultad."
LAURA,258046,31.6,Female,1.1645916935998184,5,False,5,2,Español,"Laura es un nombre femenino de profundo arraigo latino, derivado de 'Laurus', que significa laurel. Este árbol, desde la Antigüedad Clásica, simboliza victoria, honor y gloria, por lo que Laura se interpreta como 'la victoriosa' o 'coronada con laureles'. Su historia es vasta, siendo popular en la antigua Roma y manteniendo una gran vigencia en España y los países hispanohablantes. Un hito cultural clave es Laura, la musa idealizada e inmortalizada en la poesía del célebre Petrarca. En la cul...",muy fácil,muy fácil,"Laura es un nombre fonéticamente muy sencillo tanto para hispanohablantes como para extranjeros. Todos sus fonemas (L, A, U, R, A) son comunes y directos en español. No presenta letras mudas, combinaciones inusuales, ni sonidos específicos del español que resulten difíciles, como la 'rr' o la 'j'. Para los hablantes de inglés, la pronunciación es casi idéntica a su versión en inglés, con la 'r' simple española siendo fácilmente asimilable. Por tanto, es un nombre de pronunciación 'Muy fácil' para ambos grupos."
MARTA,227834,32.6,Female,1.0282414140099867,12,False,5,2,Español,"Marta es un nombre de profundo arraigo español, aunque su origen etimológico es arameo, derivado de 'Martha', que significa 'señora' o 'ama de casa'. Su vasta popularidad en España y Latinoamérica se debe principalmente a Santa Marta de Betania, la hermana bíblica de María y Lázaro, venerada como patrona de los hosteleros y cocineros. Su onomástica se celebra el 29 de julio. Es un nombre clásico que evoca calidez y tradición. En la cultura española, ha sido llevado por diversas personalidades...",muy fácil,fácil,"El nombre 'Marta' es muy fácil de pronunciar para hablantes de español, ya que todos sus fonemas (m, a, r simple, t) son comunes y nativos del idioma, sin combinaciones inusuales ni letras mudas. Para los extranjeros, específicamente angloparlantes, la pronunciación es fácil. Aunque la 'r' simple española (tap) y la vocal 'a' abierta difieren de sus contrapartes inglesas, estas diferencias son menores y generalmente no presentan una gran dificultad. No contiene sonidos específicos del español como la 'ñ' o la 'j' fuerte, lo que facilita su asimilación."
CRISTINA,226985,37.2,Female,1.0244097779921209,13,False,8,3,Español,"Cristina es un nombre femenino de origen latino, derivado de Christianus, que significa 'seguidor de Cristo' o 'consagrada a Cristo'. Es un nombre profundamente arraigado en la cultura española y muy popular en el mundo hispanohablante, debido a su fuerte conexión con la fe cristiana. Celebrado por santas como Santa Cristina, su historia se enlaza con la devoción. Entre sus portadoras célebres encontramos a Cristina Kirchner, ex Presidenta de Argentina, y la presentadora española Cristina Ped...",muy fácil,muy fácil,"Cristina is a phonetic name, pronounced exactly as written. For Spanish speakers, it is 'muy fácil' as it exclusively uses common Spanish phonemes with no unusual combinations or silent letters; all sounds are intuitive. For foreigners, particularly English speakers, it is also 'muy fácil.' The 'R' is a simple, non-rolled R, and the vowels (I, A) are straightforward to pronounce. There are no problematic sounds like the Spanish 'ñ', 'rr', or 'j', nor any silent letters or tricky spellings. Its international familiarity also aids in its ease of pronunciation."
PABLO,223789,28.9,Male,1.0323402236588766,19,False,5,2,Español,"Pablo es un nombre masculino de origen latino, derivado de 'Paulus', que significa 'pequeño' o 'humilde'. Su gran popularidad se debe a San Pablo Apóstol, una figura clave en la difusión del cristianismo, lo que le confiere un profundo arraigo histórico y cultural, especialmente en España y Latinoamérica. Es un nombre que evoca fuerza y serenidad. Entre los personajes famosos destacan el pintor español Pablo Picasso, el poeta chileno Pablo Neruda y el violonchelista Pablo Casals. Sus variante...",muy fácil,fácil,"Para hispanohablantes, 'Pablo' es muy fácil de pronunciar, ya que todos sus fonemas (P, A, B, L, O) son comunes y nativos del español, sin combinaciones inusuales ni letras mudas. Para extranjeros (angloparlantes), es fácil. Las consonantes P, B, L son similares al inglés. Las vocales 'a' y 'o' son puras y consistentes, lo que difiere de la variabilidad del inglés pero no presenta una dificultad significativa, al carecer de sonidos exclusivos del español como la 'rr' o la 'ñ'."
LUCIA,214434,24.6,Female,0.9677656511838334,15,False,5,2,Español,"Lucía, de origen latino, procede de 'lux', que significa 'luz'. Por ello, se interpreta como 'la que lleva la luz' o 'luminosa'. Es un nombre clásico y muy extendido en España e Italia, con una profunda raíz cultural ligada a Santa Lucía de Siracusa. Esta mártir, venerada como patrona de la vista, es celebrada el 13 de diciembre, y su figura aporta una conexión histórica con la claridad y la esperanza. Entre sus variantes en otros idiomas se encuentran Lucy en inglés o Lucie en francés. Curio...",muy fácil,fácil,"Para españoles, 'Lucia' es 'muy fácil' de pronunciar. Todas sus letras corresponden a fonemas españoles comunes, sin combinaciones inusuales o letras mudas. La pronunciación es completamente intuitiva. Para extranjeros (angloparlantes), se considera 'fácil'. Aunque la estructura es sencilla, el sonido de la 'c' antes de la 'i' puede ser un desafío. En español, se pronuncia como una 's' (en América Latina) o una 'z' castellana (interdental). Los angloparlantes a menudo lo adaptan a un sonido 'see' o 'shee', lo que difiere de la fonética española correcta, aunque los vocales son adaptables."
SERGIO,209553,31.4,Male,0.966669455998233,22,False,6,2,Español,"El nombre Sergio es de origen latino, derivado de la antigua gens romana Sergia, una influyente familia patricia. Aunque su etimología exacta es incierta, a menudo se le relaciona con 'el que protege' o 'el guardián'. Este nombre clásico se popularizó en la Península Ibérica durante el Imperio Romano y ha mantenido una fuerte presencia en España y Latinoamérica. Entre los personajes conocidos se encuentran el aclamado director de cine Sergio Leone y el futbolista español Sergio Ramos. Sus var...",muy fácil,difícil,"Para españoles, 'Sergio' es muy fácil de pronunciar, ya que todos sus fonemas (S, E, R simple, G fuerte, I, O) son comunes y las combinaciones intuitivas. No hay letras mudas ni sonidos complejos. Para extranjeros, especialmente angloparlantes, la dificultad aumenta a 'difícil' principalmente debido a la 'r' simple, que es una vibrante simple (tap) y difiere de la 'r' inglesa. Las vocales 'e' e 'i' también requieren un ajuste a sus sonidos puros españoles. La pronunciación es completamente fonética."
