Nombre,Frecuencia,Edad Media (*),Gender,Percentage,Popularity,Is_Compound,Character_Count,Syllable_Count,Family_Origin,Name_Description,Pronunciation_Spanish,Pronunciation_Foreign,Pronunciation_Explanation
MARIA CARMEN,636109,60.3,Female,2.8708341056404163,1,True,12,4,Otro,"María Carmen es un nombre compuesto que combina dos elementos: María, de origen hebreo, que significa 'la elegida' o 'la amada', y Carmen, de origen latino, que se relaciona con 'jardín' o 'viña'. Esta combinación se ha popularizado en países hispanohablantes y simboliza una fuerte conexión entre la devoción y la naturaleza. En la historia cultural, María tiene un importante vínculo religioso, siendo un nombre tradicional en el cristianismo, mientras que Carmen se asocia con la Virgen del Car...",Muy fácil,Fácil,"Para los españoles, 'María' y 'Carmen' son fonemas comunes, por lo que su pronunciación es muy fácil. Para hablantes de inglés, 'Carmen' es más accesible, aunque 'María' puede ser un poco más complicado debido al acento en la 'í'. No hay letras mudas ni pronunciaciones no intuitivas en los nombres. La dificultad varía, ya que los fonemas presentes son familiares para los españoles, pero el acento de 'María' puede no ser tan intuitivo para extranjeros."
MARIA,568535,48.3,Female,2.5658647625647086,2,False,5,2,Otro,"María es un nombre de origen hebreo que significa 'la elegida' o 'la amada'. Es uno de los nombres más populares en muchas culturas, especialmente en el mundo hispanohablante. Históricamente, María es una figura central en el cristianismo, siendo la madre de Jesucristo, lo que ha influido en su uso a lo largo de los siglos. Entre las variantes del nombre se encuentran Mary en inglés, Marie en francés y María en italiano. Personajes célebres como la actriz María Félix y la cantante María Calla...",Muy fácil,Muy fácil,"El nombre 'María' se pronuncia sin dificultad para los hablantes de español, dado que contiene fonemas comunes: m, a, ɾ, i, a. No presenta letras mudas ni pronunciaciones no intuitivas. Para hablantes de inglés, 'María' también se considera muy fácil, ya que la estructura es simple y se asemeja a nombres internacionales. No hay sonidos que resulten problemáticos, aunque es posible que algunos extranjeros no pronuncien la 'r' como en español, pero esto no complica la comprensión."
CARMEN,357905,60.5,Female,1.6152670070368964,3,False,6,2,Otro,"Carmen es un nombre de origen latino que se relaciona con la palabra 'Carmen', que significa 'canción' o 'poema'. Históricamente, Carmen ha sido asociado con la Virgen del Carmen, venerada en la tradición católica, lo que le confiere un significado espiritual profundo. Este nombre ha sido popular en diversas culturas y ha inspirado a numerosos personajes famosos, como la famosa ópera 'Carmen' de Georges Bizet, que presenta una historia apasionante y trágica. En cuanto a variantes, encontramos...",Muy fácil,Fácil,"Para los españoles, 'Carmen' solo utiliza fonemas comunes y no presenta dificultades. Para los extranjeros, aunque el nombre es bastante sencillo, la pronunciación puede ser levemente peculiar al estar acostumbrados a una pronunciación más anglosajona. Sin embargo, no contiene sonidos problemáticos, letras mudas o pronunciaciones no intuitivas. Comparado con otros nombres, 'Carmen' no presenta problemas para la mayoría de los hablantes de inglés, ya que su estructura es bastante accesible."
ANA MARIA,268207,54.4,Female,1.210449471665232,4,True,9,4,Otro,"Ana María es un nombre compuesto que combina dos nombres de origen hebreo y latín. 'Ana' proviene del hebreo 'Hannah', que significa 'gracia', mientras que 'María' tiene múltiples interpretaciones, a menudo asociada con 'amada' o 'la elegida'. Este nombre es muy popular en la cultura hispana y ha sido llevado por numerosas figuras notables, como la escritora Ana María Matute y la cantante Ana María Polo. Entre sus variantes en otros idiomas se encuentran Anne-Marie en francés y Anna Maria en ...",Muy fácil,Muy fácil,"El nombre 'Ana María' contiene solo fonemas comunes en el español, como las vocales y las consonantes 'n' y 'm'. No hay sonidos problemáticos, letras mudas o pronunciaciones no intuitivas. Para los hablantes extranjeros, especialmente en inglés, 'Ana' y 'María' son igualmente fáciles de pronunciar, ya que utilizan sonidos simples y familiares. La combinación de un nombre compuesto no presenta dificultad, ya que ambos nombres son pronunciables sin complicaciones en ambas lenguas."
LAURA,258046,31.6,Female,1.1645916935998184,5,False,5,2,Otro,"Laura es un nombre de origen latino que significa 'laurel', símbolo de victoria y honor en la antigua Roma. A lo largo de la historia, ha sido asociado con la poesía y la literatura, destacando en obras como 'El Cancionero' de Petrarca, donde Laura es la musa del poeta. Este nombre ha sido llevado por numerosas figuras famosas, como la actriz Laura Linney y la escritora Laura Esquivel, conocida por su novela 'Como agua para chocolate'. En otros idiomas, Laura se traduce como Lore en italiano ...",Muy fácil,Muy fácil,"El nombre 'Laura' contiene únicamente fonemas comunes en español, por lo que es muy fácil de pronunciar para los hablantes nativos. No hay sonidos problemáticos, letras mudas ni pronunciaciones no intuitivas. Para hablantes de inglés, 'Laura' es igualmente muy fácil, ya que es un nombre internacional y tiene una fonética sencilla que se adapta bien al inglés. No presenta peculiaridades que compliquen su pronunciación, lo que lo hace accesible en ambos contextos."
MARIA PILAR,256038,60.2,Female,1.155529355409153,6,True,11,4,Otro,"María Pilar es un nombre compuesto que combina dos componentes de gran significado. María, de origen hebreo, significa 'la deseada' o 'la amada', mientras que Pilar proviene del latín 'pilaris', que hace referencia a 'pilastra' o 'Pilar', simbolizando una base firme y sostén. Este nombre tiene un importante contexto cultural en países de habla hispana, donde muchas mujeres llevan estos nombres en honor a la Virgen María y a la veneración a la Virgen del Pilar. Entre sus variantes en otros idi...",Muy fácil,Fácil,"El nombre 'Maria Pilar' es muy fácil de pronunciar para los españoles, ya que todos los fonemas son comunes en el idioma español. Sin embargo, para hablantes de inglés, 'Pilar' puede ser un poco más complicado debido a la 'P' inicial y la pronunciación de la 'I' y 'L', que pueden no ser tan intuitivas. No hay sonidos problemáticos, letras mudas o pronunciaciones no intuitivas. Ambas partes del nombre se pronuncian de manera clara en español, pero la combinación puede ser ligeramente más desafiante para extranjeros."
MARIA DOLORES,249875,59.7,Female,1.127715017625751,7,True,13,5,Otro,"María Dolores es un nombre compuesto que une dos elementos significativos: María, de origen hebreo, que significa 'la elegida', y Dolores, que proviene del latín 'dolor', refiriéndose a la Virgen María en su advocación de Nuestra Señora de los Dolores, simbolizando la compasión. Este nombre es popular en el mundo hispanohablante y evoca una fuerte conexión religiosa. En la cultura española, María Dolores ha sido utilizado por diversas figuras, incluyendo artistas y escritores, y también apare...",Muy fácil,Fácil,"El nombre 'María Dolores' es muy fácil para los españoles, ya que contiene fonemas comunes como 'M', 'a', 'r', 'i', y 'D'. Para extranjeros, 'María' puede resultar un poco más complicado por la acentuación y la 'r' suave, pero en general es comprensible; 'Dolores' puede ser fácil por la fonética mayormente clara. No hay letras mudas ni pronunciaciones no intuitivas. En los hablantes de inglés, el sonido 'r' puede presentar dificultades menores, exceso de sílabas no comunes en su idioma."
ISABEL,249655,59.1,Female,1.1267221319674114,8,False,6,3,Otro,"Isabel es un nombre de origen hebreo que significa 'Dios es mi juramento'. A lo largo de la historia, ha sido portado por figuras significativas, como la Reina Isabel I de Inglaterra, quien desempeñó un papel crucial en el desarrollo de la cultura y la política inglesa durante el siglo XVI. También se asocia con la Santa Isabel, madre de Juan Bautista, y ha sido popular en diversas culturas. En el ámbito internacional, su variante en inglés es Elizabeth, en francés es Isabelle, y en italiano ...",Muy fácil,Muy fácil,"El nombre 'Isabel' es muy fácil de pronunciar tanto para españoles como para extranjeros, ya que contiene fonemas comunes en ambos idiomas. No hay sonidos problemáticos específicos, letras mudas o pronunciaciones no intuitivas. Para los españoles, 'Isabel' se pronuncia tal como se escribe, y para los hablantes de inglés, la estructura del nombre es simple y no presenta dificultades particulares en su pronunciación."
JOSEFA,247271,70.1,Female,1.1159628619243107,9,False,6,3,Otro,"Josefa es un nombre de origen hebreo que significa 'Dios ha añadido' o 'Dios proporciona'. Aunque su raíz proviene del masculino José, su uso es popular en varias culturas, especialmente en países de habla hispana. A lo largo de la historia, Josefa ha sido un nombre vinculado a figuras notables, como Josefa de España, una destacada feminista y activista de principios del siglo XX. En el ámbito literario, aparece en obras de escritores como José de Echegaray. Variantes del nombre en otros idio...",Muy fácil,Fácil,"Para los españoles, 'Josefa' contiene fonemas comunes y fáciles de pronunciar en español. No presenta letras mudas ni combinaciones problemáticas. Para los hablantes de inglés, puede ser un poco más complicado debido a la pronunciación de la 'J', que se asemeja al sonido francés, y la 'F', que puede resultar menos intuitiva. Sin embargo, los sonidos en 'Josefa' no son extremadamente difíciles y la estructura del nombre es sencilla, lo que lo hace relativamente fácil en comparación con otros nombres más complicados."
MARIA TERESA,243086,60.2,Female,1.09707546883271,10,True,12,5,Otro,"María Teresa es un nombre compuesto que une la tradición religiosa de María con el significado de 'la que cosecha' en relación a Teresa. Este nombre ha sido popular en diversas culturas, especialmente en el mundo hispanohablante y en Europa. Históricamente, María Teresa de Austria fue una figura clave en la política europea del siglo XVIII, destacándose por sus reformas en el Imperio Austriaco. En el ámbito cultural, el nombre ha sido popularizado por diversos personajes, como María Teresa de...",Muy fácil,Fácil,"El nombre 'María Teresa' no presenta fonemas problemáticos para los españoles, ya que todos son comunes en el idioma. La pronunciación es intuitiva y no incluye letras mudas. Para los extranjeros, aunque María se considera fácil, Teresa presenta una 'r' que puede ser un poco complicada, aunque no tan difícil como otros sonidos típicos del español. En conjunto, los hablantes de inglés pueden encontrar la pronunciación de 'María Teresa' como accesible, pero con ligeros desafíos en el sonido de la 'r'."
ANA,242495,45.1,Female,1.0944082169050788,11,False,3,2,Otro,"Ana es un nombre de origen hebreo que significa 'llena de gracia' o 'compasiva'. Este nombre ha tenido un gran impacto en diversas culturas a lo largo de la historia, siendo muy popular en tradiciones cristianas debido a la figura de Santa Ana, la madre de la Virgen María. En la literatura y el cine, Ana ha sido representada en personajes memorables como Ana Frank, cuyo diario se convirtió en un símbolo del sufrimiento durante la Segunda Guerra Mundial. Además, el nombre cuenta con variantes ...",Muy fácil,Muy fácil,"El nombre 'Ana' es muy fácil de pronunciar tanto para españoles como para extranjeros, ya que consiste en fonemas comunes en ambos idiomas. No presenta sonidos problemáticos, letras mudas ni pronunciaciones no intuitivas. Para los españoles, cada letra corresponde a un sonido claro y conocido, mientras que para hablantes de inglés, 'Ana' también es un nombre internacionalmente reconocible y sencillo de pronunciar. Esto lo clasifica como 'muy fácil' para ambos grupos."
MARTA,227834,32.6,Female,1.0282414140099867,12,False,5,2,Otro,"Marta es un nombre que tiene un origen intrigante y diverso. Etimológicamente, proviene del arameo 'Marta', que significa 'señora' o 'ama de casa', reflejando el respeto hacia la figura femenina en la tradición. En la cultura cristiana, Marta es conocida por ser una de las amigas de Jesús, responsable de la hospitalidad en el Nuevo Testamento, lo que la convierte en un símbolo de servicio y dedicación. En el ámbito cultural, Marta ha sido el nombre de diversas figuras notables, como la escrit...",Muy fácil,Muy fácil,"El nombre 'Marta' contiene solo fonemas comunes en español, como 'M', 'A', 'R', y 'T', haciendo que su pronunciación sea intuitiva y sencilla tanto para hablantes españoles como para extranjeros. No hay sonidos problemáticos ni letras mudas en su estructura. Para los españoles, es una pronunciación directa y para los hablantes de inglés, también resulta fácil debido a la similitud en la representación fonética. En conclusión, 'Marta' se considera accesible para ambos grupos sin dificultades significativas."
CRISTINA,226985,37.2,Female,1.0244097779921209,13,False,8,3,Otro,"Cristina es un nombre de origen latino que significa 'la ungida' o 'la consagrada a Cristo'. Tiene un fuerte trasfondo histórico y cultural, utilizado desde la Edad Media, especialmente en contextos cristianos. A lo largo de los siglos, Cristina ha sido popular en diversas culturas y ha encontrado su lugar en la literatura y el arte, siendo el nombre de la famosa reina de Suecia, Cristina de Suecia, conocida por su intellecto y patronazgo de las artes. En otros idiomas, las variantes incluyen...",Muy fácil,Fácil,"El nombre 'Cristina' contiene fonemas comunes en español, como la 'C', 'r', 'i', 's', 't', 'n' y 'a', sin sonidos problemáticos ni letras mudas. Para hablantes españoles, su pronunciación es directa y natural. No hay peculiaridades que dificulten su pronunciación. Sin embargo, para hablantes de inglés, la 'r' puede ser un poco complicada, ya que no se pronuncia igual que en su lengua, pero no es un sonido excesivamente ajeno, lo que la hace 'fácil' para ellos."
MARIA ANGELES,219914,58.5,Female,0.9924975303097529,14,True,13,5,Otro,"María Ángeles es un nombre compuesto que combina dos elementos: María, de origen hebreo que significa 'amada' o 'la que es amada', y Ángeles, que proviene del griego 'angelos', que significa 'mensajero'. Este nombre refleja una conexión espiritual y un aura de protección. En la cultura hispana, María Ángeles es muy popular y a menudo se asocia con la Virgen María y los ángeles, símbolos de fe y esperanza. A lo largo de la historia, ha sido llevado por muchas figuras notables, incluidas artist...",Muy fácil,Fácil,"Para los españoles, 'María' es un nombre común y fácil de pronunciar. 'Ángeles' presenta una 'g' suave que puede ser menos habitual pero no problemática. Para los extranjeros, 'María' puede ser confuso por la tilde y la pronunciación de la 'r'. 'Ángeles' puede ser un poco complicado debido a la 'g' y la combinación de sonidos, pero aún así es reconocible y más fácil en comparación con nombres más complejos. No hay letras mudas o pronunciaciones no intuitivas significativas en el nombre."
LUCIA,214434,24.6,Female,0.9677656511838334,15,False,5,2,Otro,"Lucia es un nombre de origen latino que significa 'luz', evocando claridad y esperanza. A lo largo de la historia, Lucia ha sido un nombre muy venerado, asociado con Santa Lucia, la patrona de los ciegos, cuya festividad se celebra el 13 de diciembre en varios países, especialmente en Suecia y en el norte de Europa. Este nombre ha inspirado a numerosas obras de arte y literatura, incluyendo música clásica como 'Lucia di Lammermoor' de Donizetti. En cuanto a variantes, Lucia se traduce en otro...",Muy fácil,Fácil,"El nombre 'Lucía' contiene fonemas comunes en español, como 'L', 'u', 'c', 'í' y 'a', lo que lo hace muy fácil de pronunciar para hispanohablantes. Para hablantes de inglés, aunque 'Lucía' puede resultar fácil, el fonema 'í' (con tilde) puede generar confusión. No hay letras mudas ni pronunciaciones no intuitivas. A pesar de ser un nombre internacional, la acentuación podría complicar un poco su pronunciación para extranjeros. En resumen, es más intuitivo para españoles que para hablantes de inglés."
MARIA ISABEL,202325,56.4,Female,0.9131163219254832,16,True,12,5,Otro,"María Isabel es un nombre compuesto que combina dos nombres de gran tradición. María proviene del hebreo 'Miriam', que significa 'la elegida' o 'la amada'. Isabel, de origen hebreo también, significa 'Dios es mi juramento'. Juntas, estas dos entidades forman una poderosa combinación de significados. En la cultura hispana, María Isabel ha sido popularizado por personajes literarios y figuras históricas, como la escritora argentina María Isabel Ocampo. La variante en inglés sería Mary Isabel. U...",Muy fácil,Fácil,"El nombre 'María Isabel' es fácil de pronunciar para los españoles, ya que ambos nombres contienen fonemas comunes en español y no presentan sonidos problemáticos. Para los hablantes de inglés, la pronunciación de 'María' puede ser un poco más difícil debido a la 'r' española y la acentuación, aunque 'Isabel' es intuitiva. No hay letras mudas ni pronunciaciones inesperadas en ninguno de los nombres. Si bien 'María' presenta la 'í' acentuada, su estructura es simple y clara."
MARIA JOSE,202287,49.6,Female,0.9129448234935882,17,True,10,4,Otro,"María José es un nombre compuesto que combina dos elementos con raíces ricas en tradición. María proviene del hebreo 'Miryam', cuyo significado exacto es objeto de debate, aunque se asocia comúnmente con 'la elegida' o 'la amada'. José, de origen hebreo también, significa 'Dios añadirá'. Este nombre ha sido ampliamente utilizado en el mundo hispanohablante, reflejando la influencia de la religión cristiana y la cultura católica. Personajes famosos como María José de España, una conocida figur...",Muy fácil,Fácil,"El nombre 'María José' contiene fonemas comunes en español, como la 'm', 'a', 'r', 'í', 'j', 'o', 's', y 'é'. No presenta sonidos problemáticos ni letras mudas. Para los españoles, la pronunciación es sencilla. Para los extranjeros, aunque 'María' se pronuncia como suena, 'José' podría presentar un ligero desafío por la 'j' española, que suena diferente a la 'j' en inglés. Sin embargo, la estructura del nombre no es compleja y suena familiar."
FRANCISCA,194475,67.0,Female,0.8776883563892666,18,False,9,3,Otro,"Francisca es un nombre de origen latino que proviene de 'Franciscus', que significa 'francés' o 'hombre libre'. Este nombre ha tenido una rica historia cultural, especialmente en países de habla hispana, donde ha sido bastante popular. Entre las figuras históricas destacadas, se encuentra Santa Francisca de Roma, una importante figura religiosa del siglo XV. El nombre tiene variantes en otros idiomas, como Francesca en italiano y Francis en inglés. Un dato curioso es que Francisca también fue...",Muy fácil,Fácil,"El nombre 'Francisca' contiene fonemas comunes en español, como la 'F', la 'r', la 'a' y la 's', que son fáciles de pronunciar. No hay letras mudas ni pronunciaciones no intuitivas. Sin embargo, para hablantes de inglés, la combinación 'Fr' y la 's' pueden resultar ligeramente más complicadas debido a su estructura. En comparación, los españols encontrarán 'Francisca' muy fácil, mientras que los extranjeros tendrán una ligera dificultad con la relación entre los sonidos, aunque aún es relativamente accesible."
ANTONIA,188716,66.8,Female,0.8516973177239071,19,False,7,3,Otro,"El nombre Antonia tiene un origen incierto, pero se asocia a menudo con el latín 'Antonius', que podría significar 'valiosa' o 'inestimable'. En la cultura romana, Antonia fue un nombre notable, ya que pertenecía a prominentes figuras de la nobleza, incluyendo a Antonia, la madre del emperador Claudio. Este nombre ha sido popular a lo largo de la historia y ha perdurado en diversas culturas. Variantes en otros idiomas incluyen Antonie en francés y Antonina en italiano. Antonia también aparece...",Muy fácil,Fácil,"El nombre 'Antonia' contiene fonemas comunes en español, como la 'a', 'n' y 't', lo que facilita su pronunciación para hablantes españoles. Para hablantes de inglés, la 't' y la 'a' son también familiares, aunque la pronunciación de la 'n' puede no ser tan intuitiva en ciertos contextos. No hay letras mudas ni pronunciaciones no intuitivas. En resumen, mientras que para los españoles es prácticamente directo, para los extranjeros podría haber una ligera complicación con la 'n', pero en general es fácil de pronunciar."
DOLORES,175700,68.8,Female,0.7929545916832197,20,False,7,3,Otro,"Dolores es un nombre de origen español que significa 'Dolores' o 'tristezas', derivado del latín 'dolor'. Se asocia a la Virgen María en su advocación como 'Nuestra Señora de los Dolores', destacando su presencia en la cultura católica. A lo largo de la historia, Dolores ha sido popular en distintas regiones de habla hispana y ha inspirado diversas obras artísticas, incluyendo canciones y literatura. Figuras famosas como Dolores del Río, una destacada actriz mexicana de la época dorada del ci...",Muy fácil,Fácil,"El nombre 'Dolores' presenta solo fonemas comunes en español, como la combinación de vocales y consonantes simples. No hay letras mudas ni pronunciaciones no intuitivas. Para los hablantes de inglés, la pronunciación es clara, aunque el sonido 'D' al inicio pueda ser un poco menos común. En comparación, los españoles lo encuentran muy fácil, mientras que para los extranjeros podría haber una ligera dificultad por la falta de familiaridad con la acentuación correcta, pero en general es bastante accesible."
PAULA,175287,22.1,Female,0.7910906745155181,21,False,5,2,Otro,"Paula es un nombre de origen latino que significa 'pequeña' o 'humilde'. A lo largo de la historia, ha sido un nombre popular en varias culturas, asociado con la idea de sencillez y modestia. En la literatura y el cine, destacan figuras como Paula Modersohn-Becker, una pionera del arte moderno, y Paula Abdul, una reconocida cantante y coreógrafa. Este nombre tiene variantes en otros idiomas, como Paulina en español y Paola en italiano. Un dato curioso es que Paula ha mantenido su popularidad ...",Muy fácil,Fácil,"El nombre 'Paula' contiene fonemas comunes en español, como 'P', 'A', 'U', y 'L', lo que facilita su pronunciación para los hablantes de español. Para extranjeros, aunque el nombre es común, la 'U' podría ser menos familiar, pero aún se considera fácil dado que no presenta sonidos específicos del español como 'rr' o 'ñ'. No hay letras mudas ni pronunciaciones no intuitivas, y no es un nombre compuesto."
SARA,175133,26.9,Female,0.7903956545546802,22,False,4,2,Otro,"Sara es un nombre de origen hebreo que significa 'princesa' o 'señora'. Con una rica historia cultural, ha sido un nombre popular en diversas religiones, siendo Sara una figura destacada en la Biblia, como esposa de Abraham y madre de Isaac. En la literatura y el cine, personajes como Sara Crewe de 'La Princesita' y Sara Connor de 'Terminator' han contribuido a su popularidad. Este nombre tiene variantes en otros idiomas, como Sarah en inglés y Zara en árabe. Un dato curioso es que Sara ha si...",Muy fácil,Muy fácil,"El nombre 'Sara' se compone de fonemas comunes en español, sin sonidos problemáticos ni letras mudas. Para los españoles, su pronunciación es intuitiva, ya que contiene vocales y consonantes frecuentes. Para los hablantes de inglés, 'Sara' también es fácil, ya que es un nombre internacional de pronunciación simple y directa. No presenta complejidades ni peculiaridades que dificulten su articulación."
ELENA,160887,38.6,Female,0.7261017950605473,23,False,5,3,Otro,"Elena es un nombre de origen otro que ha perdurado a lo largo de los siglos. Su etimología sugiere un significado relacionado con 'luz' o 'brillo', lo que le confiere un aura especial. Históricamente, Elena de Troya es una figura mítica que ha inspirado numerosas obras de arte y literatura, simbolizando la belleza y el deseo. En la cultura contemporánea, se destaca la actriz española Elena Anaya y la escritora Elena Poniatowska, quienes han dejado su huella en el cine y la literatura. Las var...",Muy fácil,Muy fácil,"El nombre 'Elena' solo utiliza fonemas comunes en español, como 'e', 'l', 'n' y 'a'. No hay letras mudas ni pronunciaciones poco intuitivas. Para los españoles, es un nombre común y sencillo de pronunciar. Para hablantes de inglés, también resulta fácil, ya que sus sonidos son claros y reconocibles, aunque puede haber una ligera adaptación de la 'e' inicial. En ambos casos, no se presentan dificultades significativas."
