Nombre,Frecuencia,Edad Media (*),Gender,Percentage,Popularity,Is_Compound,Character_Count,Syllable_Count,Family_Origin,Name_Description,Pronunciation_Spanish,Pronunciation_Foreign,Pronunciation_Explanation
CAROLINA,67465,35.6,Female,0.3044774133631668,72,False,8,4,Otro,"Carolina es un nombre de origen italiano que se deriva del nombre masculino Carlos, que significa 'hombre libre'. A lo largo de la historia, Carolina ha sido un nombre popular en varias culturas y se ha asociado con la realeza, siendo utilizado por varias reinas y princesas. En la literatura, Carolina ha sido protagonista en obras como 'Carolina Coronado', una destacada escritora española del siglo XIX. También es el nombre de una famosa canción de Joaquín Sabina, lo que resalta su presencia ...",Muy fácil,Fácil,"Para los españoles, 'Carolina' utiliza fonemas comunes y no presenta sonidos problemáticos. En cambio, para hablantes de inglés, aunque la pronunciación es clara, la combinación de 'C' (como 'k') y 'R' puede no ser tan intuitiva. No hay letras mudas ni pronunciaciones complicadas. Sin embargo, la 'R' podría causar ligera dificultad a los extranjeros. No es un nombre compuesto, por lo que solo se evalúa una parte."
INES,63756,35.2,Female,0.287738263786883,73,False,4,2,Otro,"Ines es un nombre de origen incierto, aunque a menudo se relaciona con el griego 'hagnos', que significa 'pura' o 'santa'. En la cultura cristiana, Ines es conocida por ser una mártir del siglo IV, lo que le otorga un significado de fortaleza y devoción. En la literatura y el arte, personajes como Inés de Castro, una trágica figura de la historia portuguesa, han inspirado diversas obras. La variante del nombre en inglés es Agnes, mientras que en italiano se usa Agnese. Un dato curioso es que ...",Muy fácil,Muy fácil,"El nombre 'Ines' es fácil de pronunciar para hispanohablantes, ya que utiliza solamente fonemas comunes en español. No contiene combinaciones inusuales ni sonidos problemáticos. Para hablantes de inglés, 'Ines' también se considera muy fácil, dado que tiene una estructura sencilla y no incluye sonidos poco comunes. No hay letras mudas ni pronunciaciones no intuitivas. En resumen, la pronunciación del nombre es accesible para ambos grupos sin complicaciones fonéticas."
MIRIAM,63275,30.4,Female,0.2855674546884219,74,False,6,2,Otro,"Miriam es un nombre de origen incierto, aunque muchos lo asocian a la cultura hebrea, donde se interpreta como 'la que es amada' o 'mar'. En la Biblia, Miriam fue la hermana de Moisés, una figura fuerte y destacada en la historia del pueblo hebreo. Su trascendencia ha hecho que el nombre perdure a lo largo de los siglos en diversas culturas. Existen varias variantes del nombre, como Mirjam en holandés y María en español. Personajes como Miriam Makeba, la icónica cantante sudafricana, han llev...",Muy fácil,Fácil,"El nombre 'Miriam' tiene fonemas comunes en español, como 'm' y 'r', que son fácilmente pronunciables para hispanohablantes. Sin embargo, para angloparlantes, la pronunciación puede inducir a confusión debido a la 'r' en medio de la palabra, que puede no ser tan clara. No presenta letras mudas ni pronunciaciones no intuitivas, aunque la estructura es un poco menos común en inglés, lo que puede dificultar ligeramente su pronunciación."
EVA MARIA,63206,44.9,Female,0.2852560496410334,75,True,9,4,Otro,"Eva María es un nombre compuesto con un trasfondo rico y profundo. Eva, de origen hebreo, significa 'vida' o 'viviente', mientras que María tiene raíces en el idioma hebreo, significando 'amada' o 'la que es deseada'. Este nombre ha sido popular en diversas culturas, especialmente en las tradiciones cristianas, donde María se asocia con la madre de Jesús. A lo largo de la historia, muchas figuras admiradas han llevado este nombre, como la famosa artista mexicana Frida Kahlo, cuyo nombre com...",Muy fácil,Fácil,"El nombre 'Eva' presenta sonidos comunes en español, mientras que 'María' también es fácil de pronunciar. No hay letras mudas ni sonidos difíciles. Para los españoles, ambos nombres son muy fáciles debido a su familiaridad. Para los extranjeros, 'María' puede ser un poco más complicado debido a la 'í' acentuada y la pronunciación de la 'a' final, aunque en general se consideran nombres accesibles. En conjunto, el nombre 'Eva María' muestra una dificultad mínima para ambos grupos."
MARTINA,63007,15.6,Female,0.2843579394318988,76,False,7,3,Otro,"Martina es un nombre de origen latino que significa 'la guerrera' o 'consagrada a Marte', el dios romano de la guerra. A lo largo de la historia, Martina ha tenido un lugar destacado en varias culturas, siendo popular en muchos países de habla hispana y en Italia. Es un nombre que ha sido llevado por diversas figuras notables, como la famosa pintora española Martina Fernández. En otros idiomas, las variantes de Martina incluyen Martine en francés y Martina en italiano, manteniendo su esencia ...",Muy fácil,Fácil,"Para los españoles, 'Martina' contiene solo fonemas comunes y es fácil de pronunciar. Para hablantes extranjeros, aunque la 'R' puede presentar un ligero desafío, la pronunciación sigue siendo clara. No hay letras mudas ni pronunciaciones que no sean intuitivas. En general, el nombre se adapta bien a ambos grupos, aunque los extranjeros podrían tener una ligera dificultad con la 'R' al intentar replicar la vibración de la lengua característica del español."
MARIA VICTORIA,62956,55.1,Female,0.2841277704838291,77,True,14,5,Otro,"María Victoria es un nombre compuesto que combina la gracia del nombre María, de origen hebreo, que significa 'la elegida' o 'la amada', con Victoria, de origen latino, que significa 'Victoria' o 'triunfo'. Este nombre evoca una fuerte connotación de éxito y amor. En la cultura hispana, María Victoria ha sido utilizado a lo largo de los siglos, simbolizando a mujeres fuertes e influyentes. Entre las personalidades notables, se encuentra María Victoria, una reconocida actriz española. En otros...",Muy fácil,Fácil,"El nombre 'María Victoria' para los españoles es 'muy fácil' ya que contiene fonemas comunes sin sonidos problemáticos ni letras mudas. Para los extranjeros, la pronunciación de 'Victoria' puede ser 'fácil' debido a la clara pronunciación, aunque la 'r' en 'María' podría presentar ligera dificultad. La combinación de ambos nombres presenta un desafío menor para los hispanohablantes por la familiaridad con la estructura y los sonidos, mientras que los hablantes de inglés podrían adaptarse bien, pero con algunas dificultades en la pronunciación de la 'r'."
LORENA,61923,31.9,Female,0.2794657210062607,78,False,6,3,Otro,"Lorena es un nombre de origen incierto, aunque se ha popularizado en diversas culturas a lo largo del tiempo. Se relaciona con la región histórica de Lorena en Francia, que a su vez proviene del latín 'Lotharingia'. Este nombre evoca imágenes de belleza y elegancia. En la cultura popular, se puede encontrar a Lorena en la música, como en la canción 'Lorena' de la famosa banda mexicana Los Bukis. Además, su variante en inglés es Lorraine, que también goza de popularidad. Un dato curioso es que...",Muy fácil,Muy fácil,"El nombre 'Lorena' contiene solo fonemas comunes y fácilmente pronunciables tanto para hablantes españoles como extranjeros. No presenta letras mudas ni pronunciaciones no intuitivas. Para los españoles, está compuesto de sonidos claros ('L', 'o', 'r', 'e', 'n', 'a'). Para los extranjeros, cumple con una estructura simple y no contiene sonidos que puedan resultar problemáticos, lo que lo hace igualmente fácil de pronunciar."
ANGELES,61288,67.8,Female,0.2765998919469616,79,False,7,3,Otro,"Angeles es un nombre de origen español que proviene de la palabra 'ángel', derivada del griego 'aggelos', que significa 'mensajero'. En el contexto cultural, se asocia con la figura de los ángeles en diversas tradiciones religiosas, simbolizando la protección y la guía. Su uso es especialmente popular en países hispanohablantes y se celebra el 2 de octubre, en honor a los Ángeles de la Guarda. Personajes famosos como Angeles Mastretta, escritora mexicana, han llevado este nombre a las letras ...",Muy fácil,Fácil,"El nombre 'Angeles' es fácil para los españoles, ya que utiliza fonemas comunes del español sin sonidos problemáticos. Para los extranjeros, la pronunciación puede ser algo menos intuitiva debido a la 'ng' que no aparece en muchas palabras en inglés, aunque los hablantes pueden adaptarse fácilmente. No hay letras mudas y la estructura del nombre es clara. En resumen, españoles lo pronuncian sin dificultad, mientras que los extranjeros pueden tener una ligera complicación por la combinación de sonidos."
ANA BELEN,60560,41.6,Female,0.2733143430411826,80,True,9,4,Otro,"Ana Belen es un nombre compuesto que combina Ana, proveniente del hebreo 'Channah' que significa 'gracia', y Belen, que tiene raíces en el hebreo 'Bethlehem', que significa 'casa del pan'. Este nombre ha sido popular en diversos contextos culturales, sobre todo en los países hispanohablantes. Ana Belen es conocido por su aparición en la obra de la exitosa cantante española Ana Belen, quien ha dejado una huella en la música y el cine. Variantes de Ana incluyen Ann, Hannah y Anna en diferentes ...",Muy fácil,Muy fácil,"El nombre 'Ana Belen' es fácil de pronunciar tanto para españoles como para hablantes de inglés. Para los españoles, ambos nombres contienen fonemas comunes y no presentan combinaciones complejas ni sonidos ajenos al español. Para los extranjeros, 'Ana' es un nombre internacional y 'Belen', aunque tiene un acento en la 'e', se pronuncia de manera intuitiva. No hay letras mudas ni pronunciaciones complicadas que puedan generar confusión. Ambos nombres son sencillos y accesibles para ambos grupos."
MARIA ELENA,60440,53.0,Female,0.2727727690457245,81,True,11,5,Otro,"María Elena es un nombre compuesto por dos componentes de profundo significado. 'María', de origen hebreo, significa 'la elegida' o 'la amada', mientras que 'Elena' proviene del griego y se relaciona con 'luz' o 'brillante'. Este nombre ha sido popular en varias culturas, resonando en la literatura y el arte. A lo largo de la historia, figuras como María Elena Walsh, escritora y compositora argentina, han dejado su huella en la cultura. En varios idiomas, se pueden encontrar variantes como Ma...",Muy fácil,Fácil,"El nombre 'María Elena' contiene fonemas comunes en español, como la 'r' suave y las vocales abiertas. Para hablantes españoles, la pronunciación es intuitiva y no presenta dificultades. Sin embargo, para extranjeros, la mezcla de vocales y la 'r' pueden causar confusión, aunque no son sonidos extremadamente complejos. Las letras no presentan silencios ni pronunciaciones no intuitivas. Cada parte del nombre es fácil de pronunciar, y su estructura es sencilla, lo que reduce la dificultad general de ambos nombres."
MARIA ROSA,59953,64.0,Female,0.2705748812474904,82,True,10,4,Otro,"María Rosa es un nombre compuesto que combina dos elementos con una rica tradición. 'María' proviene del hebreo 'Miryam', que significa 'la elegida' o 'la amada', mientras que 'Rosa' deriva del latín 'Rosa', simbolizando la belleza y la delicadeza. Este nombre ha sido popular en diversas culturas, especialmente en el ámbito hispanohablante. María Rosa también es un nombre de referencia en la literatura y la música, destacando personajes en obras y canciones. Variantes de María incluyen Mash...",Muy fácil,Fácil,"Para los españoles, 'María Rosa' es muy fácil, ya que contiene fonemas comunes en el idioma español. Para los hablantes de inglés, la parte 'María' puede ser un poco complicada debido a la 'í' acentuada, que no se encuentra en su lengua, pero 'Rosa' es bastante intuitiva. No hay letras mudas ni pronunciaciones no intuitivas en ninguna parte del nombre, lo que facilita la adaptación. En resumen, la dificultad aumenta ligeramente para los extranjeros debido a la acentuación, pero principalmente es un nombre accesible."
VICTORIA,59281,45.5,Female,0.2675420668729251,83,False,8,3,Otro,"Victoria es un nombre de origen latino que significa 'Victoria' y simboliza el triunfo y el éxito. Históricamente, la figura de la diosa romana de la Victoria, que se representaba con alas, ha dado al nombre una resonancia poderosa en la cultura. A lo largo de la historia, varias reinas y líderes han llevado este nombre, como la Reina Victoria de Inglaterra, cuyo reinado marcó una era de esplendor y cambios sociales importantes. En otros idiomas, Victoria se traduce de manera similar, como Vi...",Muy fácil,Fácil,"El nombre 'Victoria' contiene fonemas comunes en español, lo que lo hace muy fácil para hablantes de español. Para los hablantes de inglés, la pronunciación también es clara, aunque la 'V' puede sonar diferente a la 'W', lo que presenta una leve dificultad. No hay letras mudas ni sonidos problemáticos relevantes que compliquen la pronunciación, lo que facilita su uso en ambos idiomas. En resumen, es un nombre que se pronuncia de manera intuitiva en español y es accesible para hablantes de inglés, con mínimas complicaciones."
MARIA CONCEPCION,58068,64.5,Female,0.2620676564021695,84,True,16,5,Otro,"María Concepción es un nombre compuesto que une María, de origen hebreo que significa 'la elegida' o 'la señora', con Concepción, que proviene del latín 'conceptio', significando 'concepción' o 'gestación'. En la tradición cristiana, María Concepción hace referencia a la Inmaculada Concepción, el dogma que sostiene que la Virgen María fue concebida sin pecado original. Este nombre es muy popular en países de habla hispana y ha sido utilizado en diversas obras literarias y artísticas. Variante...",Muy fácil,Fácil,"El nombre 'María Concepción' es fácil de pronunciar para los españoles, ya que contiene fonemas comunes y conocidos en el idioma. La 'C' en 'Concepción' se pronuncia como 'S', lo que puede llevar a una ligera confusión pero no es un sonido ajeno. Para los hablantes de inglés, la 'ñ' en 'Concepción' puede ser complicada, pero el resto del nombre sigue una estructura clara. La combinación de ambos nombres se pronuncia de manera intuitiva en español, aunque 'Concepción' podría ser menos familiar para algunos extranjeros."
ALEJANDRA,55728,24.7,Female,0.2515069634907368,85,False,9,4,Otro,"Alejandra es un nombre de origen griego que significa 'defensora de los hombres'. Este nombre tiene profundas raíces culturales, asociado a la figura histórica de Alejandro Magno, el famoso conquistador. A lo largo de la historia, Alejandra ha sido un nombre popular en diversas culturas, simbolizando fuerza y liderazgo. Entre las variantes en otros idiomas se encuentran Alexandra en inglés y Alessandra en italiano. Personajes famosos como Alejandra Pizarnik, una destacada poetisa argentina, h...",Muy fácil,Fácil,"Para los españoles, 'Alejandra' contiene solo fonemas comunes. La combinación de letras es intuitiva y no presenta sonidos problemáticos. Para los hablantes de inglés, la 'J' puede resultar en una ligera dificultad, ya que se pronuncia como una 'h' suave en inglés, lo que podría ser confuso. Sin embargo, no tiene sonidos específicos del español que dificulten la pronunciación. No hay letras mudas ni pronunciaciones no intuitivas en el nombre."
AMPARO,54918,66.3,Female,0.2478513390213947,86,False,6,3,Otro,"El nombre Amparo tiene su origen en la palabra latina 'amparare', que significa 'proteger' o 'cobijar'. Este nombre es común en la cultura hispana, particularmente en países de habla española, donde se asocia con la devoción a la Virgen de Amparo, una figura venerada en diversas comunidades. A lo largo de la historia, Amparo ha sido un nombre popular y ha sido llevado por figuras notables en la literatura y el arte. Su variante en inglés, 'Shelter', refleja el mismo sentido de protección. Un ...",Muy fácil,Muy fácil,"El nombre 'Amparo' contiene fonemas comunes en español como la 'A', 'M', 'P', 'R' y 'O', lo que lo hace sencillo para hablantes nativos. No presenta sonidos problemáticos ni letras mudas. Para hablantes de inglés, la pronunciación tampoco entraña dificultad, ya que los fonemas son fáciles de articular y no hay combinaciones especialmente complicadas. En resumen, Amparo resulta accesible tanto para españoles como para extranjeros."
MARIA ANTONIA,54140,62.4,Female,0.2443401342841748,87,True,13,5,Otro,"María Antonia es un nombre compuesto que une las raíces del hebreo 'María', que significa 'amada' o 'señora', con 'Antonia', de origen latino, que puede interpretarse como 'valiosa' o 'invaluable'. Este nombre ha dejado huella en la historia, siendo famoso por María Antonia de Austria, cuya vida estuvo marcada por el glamur y el drama de la corte francesa, convirtiéndose en un símbolo de la opulencia del siglo XVIII. La combinación de ambos nombres aporta una doble carga cultural y emocional,...",Muy fácil,Fácil,"El nombre 'María Antonía' es muy fácil para españoles, ya que contiene solo fonemas comunes del español sin letras mudas o pronunciaciones no intuitivas. Para extranjeros, la pronunciación suele ser clara, aunque 'María' puede presentar una dificultad leve por la 'í' acentuada y la 'ñ', que no es común en inglés. 'Antonía' es más accesible, pero sus vocales y el acento pueden causar confusión. En conjunto, es un nombre compuesto que es fácil de pronunciar en ambos contextos, aunque presenta leves desafíos para hablantes no hispanohablantes."
LIDIA,53211,36.9,Female,0.2401474489360034,88,False,5,2,Otro,"Lidia es un nombre de origen incierto, aunque se asocia comúnmente con la antigua región de Lidia en Asia Menor. Su significado etimológico podría relacionarse con 'la que proviene de Lidia' o 'la mujer de Lidia'. En la cultura griega, Lidia fue una mujer mencionada en obras de la época, y en la Biblia, Lidia es conocida como una de las primeras conversas al cristianismo en Filipos. Entre los personajes famosos, destaca Lidia Muntz, una renombrada artista contemporánea. En otros idiomas, Lidi...",Muy fácil,Fácil,"El nombre 'Lidia' contiene fonemas comunes en español, lo que lo hace muy fácil de pronunciar para hablantes españoles. Para extranjeros, aunque la pronunciación es clara, pueden encontrar la combinación 'DIA' ligeramente menos habitual, pero no presenta sonidos problemáticos específicos ni letras mudas. En general, la dificultad para los españoles es menor que para los extranjeros debido a la familiaridad con los fonemas. No tiene una estructura compuesta, por lo que se evalúa como un solo nombre."
CELIA,53087,34.2,Female,0.23958782247403,89,False,5,2,Otro,"Celia es un nombre femenino de origen incierto, aunque se asocia comúnmente con el latín 'caelum', que significa 'cielo'. A lo largo de la historia, Celia ha sido un nombre popular en diversas culturas. En la literatura, destaca la figura de Celia, un personaje en 'Como gustéis', de William Shakespeare. En el ámbito musical, Celia Cruz, conocida como la 'Reina de la Salsa', dejó una huella imborrable en la música latina. El nombre también tiene varias variantes en otros idiomas, como Célia en...",Muy fácil,Muy fácil,"El nombre 'Celia' contiene solo fonemas comunes del español, lo que lo hace fácilmente pronunciable tanto para españoles como para hablantes de inglés. No hay letras mudas ni pronunciaciones no intuitivas. Los sonidos son claros y no presentan peculiaridades que dificulten la pronunciación. En inglés, 'Celia' es igualmente sencillo, al ser un nombre internacional con una estructura fonética simple."
CATALINA,51368,61.3,Female,0.2318297749890929,90,False,8,4,Otro,"Catalina es un nombre con raíces griegas que significa 'pura' o 'inmaculada'. Su historia cultural es rica, asociándose con Santa Catalina de Siena, una figura destacada en la espiritualidad medieval y una de las patronas de Italia. Su popularidad se ha extendido a través de diversas culturas, encontrando variantes como Katherine en inglés, Caterina en italiano y Katja en ruso. Catalina también ha inspirado a personajes célebres en la literatura y el arte, siendo mencionado en obras como 'La ...",Muy fácil,Fácil,"Para los españoles, 'Catalina' consiste en fonemas comunes y no presenta dificultades de pronunciación. Sin embargo, para hablantes de inglés, la combinación de letras puede resultar un poco menos intuitiva, especialmente la 'C' seguida de 'A', que se pronuncia diferente en inglés. No hay fonemas ajenos ni letras mudas en el nombre. En general, el nombre mantiene una estructura sencilla en ambos casos, pero para los extranjeros podría requerir un poco de adaptación al sonido 'CAT' al inicio."
FATIMA,51104,38.7,Female,0.2306383121990851,91,False,6,3,Otro,"Fatima es un nombre de origen árabe que significa 'la que es destetada' o 'la que se aparta'. En la cultura islámica, Fatima es venerada como la hija del profeta Mahoma y madre de los imanes, lo que convierte a este nombre en un símbolo de fe y devoción. En el ámbito occidental, Fatima también es conocida por las apariciones marianas en 1917 en la ciudad portuguesa de Fátima, convirtiéndola en un lugar de peregrinación. Entre personajes famosos, destaca Fatima Bhutto, escritora y política paq...",Muy fácil,Fácil,"El nombre 'Fatima' es fácil de pronunciar para los españoles, ya que contiene fonemas comunes en español. Para los extranjeros, puede ser fácil, aunque el sonido 'F' inicial y la acentuación en la 'i' podrían presentar ligeras dificultades. No hay letras mudas ni pronunciaciones no intuitivas, aunque la 'T' puede ser confusa para algunos. En general, la dificultad varía, siendo más familiar para hablantes de español y ligeramente menos para hablantes de inglés, que podrían no estar acostumbrados a la acentuación."
MARIA NIEVES,50792,59.5,Female,0.2292302198108941,92,True,12,4,Otro,"María Nieves es un nombre compuesto que combina dos elementos con profundo significado. María, de origen hebreo, significa 'la elegida' o 'la amada', y es uno de los nombres más populares en el mundo, vinculado a la figura de la Virgen María en el cristianismo. Nieves, que puede aludir a la nieve, evoca pureza y frescura. Culturalmente, María Nieves se ha utilizado en la literatura y el arte, apareciendo en obras que representan la conexión entre lo divino y lo terrenal. Variantes de María in...",Muy fácil,Fácil,"El nombre 'María' es completamente familiar para los hablantes españoles, ya que contiene fonemas comunes. 'Nieves' también es accesible, aunque la 'v' puede ser un poco peculiar para algunos. Para los hablantes de inglés, 'María' puede ser un poco desafiante por la 'í' acentuada y la pronunciación de la 'a' abierta. 'Nieves' puede resultar más complicado debido a la 'ie' y la 'v', que no son comunes en inglés. Ambos nombres compuestos son, sin embargo, en general más fáciles que otras opciones."
AINHOA,50769,21.0,Female,0.2291264181284313,93,False,6,2,Otro,"Ainhoa es un nombre de origen vasco que ha ganado popularidad en diversos países. Se deriva de la voz 'Ainhoa', que se refiere a un lugar en Navarra, España, famoso por su santuario dedicado a la Virgen de Ainhoa. Este nombre se ha convertido en un símbolo de identidad cultural vasca. Ainhoa es también el nombre de una localidad en Francia, lo que resalta su importancia en la cultura regional. Entre los personajes famosos, destaca Ainhoa Arteta, una reconocida soprano española. En otros idiom...",Fácil,Difícil,"Para españoles, 'Ainhoa' contiene fonemas comunes, como 'A' y 'n', pero la combinación 'ih' puede resultar menos intuitiva. Para extranjeros, especialmente angloparlantes, la 'ñ' se convierte en un reto, ya que no existe en inglés, lo que complica la pronunciación. Además, el sonido de la 'A' en diptongo puede ser confuso. La diferencia radica en la familiaridad de los españoles con fonemas similares, mientras que los extranjeros luchan con la 'ñ' y combinaciones. No hay letras mudas ni pronunciaciones particularmente complejas en sí."
OLGA,49664,48.2,Female,0.224139424253588,94,False,4,2,Otro,"Olga es un nombre de origen eslavo, comúnmente asociado con la nobleza y la realeza. Su etimología se vincula al antiguo nórdico 'heilagr', que significa 'sagrada' o 'consagrada'. Históricamente, Olga de Kiev, una figura prominente del siglo X, fue una gran duquesa y es conocida por su conversión al cristianismo, convirtiéndose en un símbolo de fe y poder en la cultura eslava. En la actualidad, el nombre ha sido popular en varios países, como Rusia, Polonia y Suecia. Variantes en otros idioma...",Muy fácil,Muy fácil,"El nombre 'Olga' contiene fonemas comunes en español, como la 'O' y la 'G', y no presenta sonidos problemáticos, ya que la pronunciación es clara y directa. No hay letras mudas ni pronunciaciones no intuitivas. Para los hablantes de inglés, 'Olga' también es fácil de pronunciar, ya que la estructura es sencilla y no incluye sonidos complejos o específicos del español. Por lo tanto, tanto para españoles como para extranjeros, 'Olga' se clasifica como muy fácil de pronunciar."
