Nombre,Frecuencia,Edad Media (*),Gender,Percentage,Popularity,Is_Compound,Character_Count,Syllable_Count,Family_Origin,Name_Description,Pronunciation_Spanish,Pronunciation_Foreign,Pronunciation_Explanation
MARIA MAR,99087,47.2,Female,0.4471911873996311,48,True,9,3,Otro,"María Mar es un nombre compuesto que fusiona María, de origen hebreo y que significa 'amada' o 'señora', con Mar, que proviene del latín 'mare', significando 'Mar'. Esta combinación sugiere una conexión poética entre la figura femenina y la vastedad del océano. En la cultura hispana, María es un nombre tradicional y muy apreciado, asociado frecuentemente a la Virgen María, y se encuentra en numerosas obras literarias y artísticas a lo largo de la historia. Variantes en otros idiomas incluyen ...",Muy fácil,Muy fácil,"El nombre 'Maria Mar' se pronuncia con fonemas comunes en español, como 'M', 'A', 'R', que son familiares para hablantes de español. No hay sonidos problemáticos ni letras mudas. Para hablantes de inglés, la pronunciación también es sencilla, sin peculiaridades que compliquen la articulación. 'María' es un nombre internacional, y 'Mar' es fácil de pronunciar. En ambos casos, no hay elementos que generen confusión ni estructuras complejas."
SANDRA,98016,33.0,Female,0.4423576394901676,49,False,6,2,Otro,"Sandra es un nombre de origen griego que deriva de la forma femenina de Alejandro, que significa 'defensora de los hombres'. A lo largo de la historia, Sandra ha sido un nombre popular en diversas culturas, especialmente en los países de habla hispana e inglesa. Es conocido por su uso en la música y el cine, como Sandra Bullock, una reconocida actriz estadounidense. En otros idiomas, Sandra tiene variantes como Alessandra en italiano y Alexandra en inglés. Un dato curioso es que, a menudo, se...",Muy fácil,Fácil,"El nombre 'Sandra' se pronuncia con fonemas comunes en español, lo que lo hace muy fácil para hablantes españoles. Para extranjeros, aunque 'Sandra' es un nombre internacional, la 'S' y la 'n' al inicio pueden representar una ligera dificultad, pero en general, la pronunciación es clara. No hay letras mudas ni pronunciaciones no intuitivas. Para hablantes de español, no hay sonidos problemáticos. Para extranjeros, podría haber complicaciones menores con la 'S', pero no son significativas."
SONIA,97917,41.0,Female,0.4419108409439147,50,False,5,2,Otro,"Sonia es un nombre de origen incierto, pero se asocia comúnmente con el griego 'sophia', que significa 'sabiduría'. A lo largo de la historia, Sonia ha sido un nombre popular en diversas culturas, especialmente en Europa y América Latina. En la literatura, Sonia aparece en la obra 'Crimen y Castigo' de Fiódor Dostoyevski, donde es un personaje central, simbolizando la bondad y la redención. Este nombre tiene variantes en otros idiomas como Sonya en ruso y Sofía en español. Un dato curioso es ...",Muy fácil,Muy fácil,"El nombre 'Sonia' se compone de fonemas completamente comunes en español, como 'S', 'O', 'N', 'I' y 'A'. No presenta sonidos problemáticos ni letras mudas, lo que facilita su pronunciación tanto para hablantes españoles como extranjeros. Para los españoles, resulta muy fácil debido a la simplicidad y familiaridad de la combinación de sonidos. Para hablantes de inglés, también es accesible, al no contener peculiaridades del español. En resumen, 'Sonia' es perfectamente pronunciable y reconocible en ambos contextos."
MARINA,97899,33.9,Female,0.441829604844596,51,False,6,3,Otro,"Marina es un nombre de origen latino que significa 'del mar' o 'Marina'. Este nombre tiene connotaciones de frescura y libertad, evocando la belleza del océano. A lo largo de la historia, ha sido popular en diversas culturas, especialmente en países de habla hispana. En la literatura, Marina aparece en obras como 'La fuerza de la gravedad' de José Luis Martín. Además, personajes célebres como la actriz Marina de Tavira han llevado el nombre a la fama. Sus variantes en otros idiomas incluyen M...",Muy fácil,Fácil,"El nombre 'Marina' contiene fonemas comunes en español, como la 'M', 'A', 'R', 'I', 'N', y 'A', que no presentan dificultad de pronunciación. Para hablantes de inglés, la apariencia de la letra 'R' puede ser un desafío menor en función de la variante dialectal, pero en general, la pronunciación es clara y sigue patrones fonéticos simples. No hay letras mudas ni pronunciaciones no intuitivas, y no hay sonidos específicos del español que compliquen la lectura. En general, la dificultad es baja para ambos grupos."
SUSANA,95270,45.7,Female,0.429964621227435,52,False,6,3,Otro,"Susana es un nombre con origen hebreo que significa 'lirio'. Su uso se ha extendido a diversas culturas a lo largo de la historia. En la Biblia, Susana es mencionada como una mujer virtuosa, lo que ha contribuido a la popularidad del nombre en contextos cristianos. Entre sus variantes en otros idiomas se encuentran Susanne en francés y alemán, y Suzanne en inglés. Personajes famosos llevan este nombre, como Susana Giménez, una destacada presentadora de televisión en Argentina. Un dato curioso...",Muy fácil,Fácil,"El nombre 'Susana' contiene solo fonemas comunes en español, por lo que es muy fácil de pronunciar para hispanohablantes. Para angloparlantes, la combinación de vocales y la 's' al inicio pueden ser menos intuitivas, pero en general no presenta dificultad significativa. No hay letras mudas ni pronunciaciones complejas. En resumen, 'Susana' es sencillo para españoles, mientras que los extranjeros pueden encontrar ligeras peculiaridades, aunque en general todavía es fácil."
ANGELA,94966,45.0,Female,0.4285926337722745,53,False,6,3,Otro,"Ángela es un nombre de origen griego que significa 'mensajera' o 'ángel'. Su uso se popularizó en la Edad Media, especialmente entre los cristianos, debido a la veneración de los ángeles. En la cultura occidental, ha sido utilizado en varias obras literarias y películas, apareciendo en personajes de novelas y series. Entre las personalidades destacadas que llevan este nombre se encuentran Ángela Merkel, la ex canciller alemana, y Ángela Lansbury, la icónica actriz británica. Variantes en otro...",Muy fácil,Fácil,"El nombre 'Angela' contiene fonemas sencillos y comunes en el español, por lo que es considerado muy fácil de pronunciar para hispanohablantes. Sin embargo, para hablantes de inglés, la pronunciación puede ser un poco menos intuitiva debido a la acentuación en la primera sílaba, que podría diferir. No hay letras mudas ni sonidos problemáticos significativos que complicuen la pronunciación en ningún caso."
NATALIA,94887,31.2,Female,0.428236097558598,54,False,7,3,Otro,"Natalia es un nombre de origen latino que significa 'nacida en Navidad'. A lo largo de la historia, ha sido apreciado en diversas culturas y tradiciones, simbolizando alegría y renovación. En la literatura, Natalia aparece en obras notables, como en las novelas de León Tolstói. Además, la popularidad del nombre se debe a su uso en diferentes países, donde se pueden encontrar variantes como Natália en portugués y Natalie en inglés. Curiosamente, en algunas culturas se asocia con la fertilidad ...",Muy fácil,Fácil,"El nombre 'Natalia' contiene fonemas comunes en español: N, A, T, L, e I. Para los españoles, la pronunciación es directa y no presenta sonidos problemáticos ni letras mudas. Sin embargo, para hablantes de inglés, puede haber ligeras diferencias en la acentuación de la 'a' y la 'i', lo que lo hace un poco menos intuitivo, pero aún fácil de pronunciar. En general, la dificultad radica en la adaptación de la fonética, con un nombre que es más familiar para los hispanohablantes."
ROSA,93402,66.2,Female,0.4215341193648041,55,False,4,2,Otro,"Rosa es un nombre con un hermoso significado etimológico que deriva del latín 'Rosa', que significa 'flor' o 'rosal'. A lo largo de la historia, la Rosa ha simbolizado el amor y la belleza, convirtiéndose en un ícono dentro de diversas culturas. En la literatura, personajes como Rosa, de 'Rosaura' de Manuel Gutiérrez Nájera, han dejado huella en la narrativa hispana. Además, en otras lenguas, el nombre aparece como Rosé en francés y Rosa en italiano, evidenciando su popularidad. Curiosamente,...",Muy fácil,Muy fácil,"El nombre 'Rosa' contiene solo fonemas comunes en español: la 'R' inicial y las vocales 'O' y 'A'. No hay sonidos problemáticos ni letras mudas, lo que lo hace también accesible para hablantes de inglés. Para los españoles, todas las letras y su pronunciación son intuitivas, y lo mismo ocurre para extranjeros, ya que no presenta peculiaridades fonéticas que dificulten su pronunciación. En resumen, 'Rosa' es un nombre sencillo y fácil de pronunciar en ambos contextos."
YOLANDA,91530,46.4,Female,0.4130855650356579,56,False,7,3,Otro,"Yolanda es un nombre de origen incierto, aunque se ha asociado comúnmente con el griego 'iolanthe', que significa 'flor de violeta'. A través de la historia, Yolanda ha sido un nombre popular en diferentes culturas, destacándose en la Edad Media en Europa, donde varias princesas y figuras nobiliarias lo llevaron. Uno de los personajes más destacados con este nombre es Yolanda de Aragon, una reina consorte del siglo XIV. En la cultura moderna, Yolanda se ha popularizado a través de la música y...",Muy fácil,Fácil,"El nombre 'Yolanda' presenta fonemas comunes en español, por lo que es muy fácil de pronunciar para los hablantes hispanohablantes. No contiene letras mudas ni pronunciaciones no intuitivas. Para hablantes de inglés, la combinación 'Yo' podría sonar un poco inusual, pero no presenta sonidos complejos. La 'Y' puede causar confusión al ser un sonido menos frecuente en inglés que en español. Sin embargo, en general, 'Yolanda' es fácil de pronunciar para ambos grupos."
SOFIA,88326,18.9,Female,0.3986255393569269,57,False,5,2,Otro,"Sofia es un nombre femenino que proviene del griego 'sophia', que significa 'sabiduría'. A lo largo de la historia, este nombre ha estado asociado con la búsqueda del conocimiento y la inteligencia. En la cultura occidental, ha sido popularizado por figuras como Santa Sofía y ha inspirado la construcción de grandes catedrales, como la famosa Hagia Sophia en Estambul. Sofía es un nombre presente en muchas lenguas, con variantes como Sophie en francés, Sofia en italiano y Sofiya en ruso. Un dat...",Muy fácil,Fácil,"Para los españoles, 'Sofia' es muy fácil de pronunciar, ya que solo contiene fonemas comunes en español. No presenta letras mudas ni pronunciaciones no intuitivas. Sin embargo, para hablantes de inglés, la pronunciación puede ser ligeramente más complicada debido a la acentuación en la 'í', que puede no ser tan evidente. No hay sonidos problemáticos ni peculiaridades fonéticas significativas que dificulten su pronunciación, por lo que se clasifica como fácil para extranjeros."
CLAUDIA,86034,18.6,Female,0.3882814760436774,58,False,7,2,Otro,"Claudia es un nombre de origen latino que proviene de 'Claudius', que significa 'cojo' o 'muerto de pie'. Este nombre ha sido utilizado desde la antigüedad, siendo popular en la Roma antigua. En la historia, Claudia se asocia con emperatrices romanas, como Claudia Octavia, quien fue la primera esposa de Nerón. Además, el nombre ha sido llevado por diversas figuras notables, desde la actriz estadounidense Claudia Schiffer hasta la escritora argentina Claudia Piñeiro. En otros idiomas, Claudia ...",Muy fácil,Fácil,"Para los españoles, 'Claudia' se compone de fonemas comunes, como la 'C', 'L', 'D' y las vocales, lo que lo hace muy fácil de pronunciar. Para los hablantes de inglés, puede ser un poco más complicado debido a la 'C' inicial que suena como 'K', además de la 'au' que no es tan intuitiva. Sin embargo, no contiene sonidos complejos ni letras mudas, por lo que su pronunciación sigue siendo relativamente accesible."
MARGARITA,84697,62.3,Female,0.3822474391109485,59,False,9,4,Otro,"Margarita es un nombre con raíces en el griego antiguo, derivado de 'margaritēs', que significa 'perla'. Este nombre ha cruzado fronteras culturales; en la literatura y la historia, Margarita aparece en diversas manifestaciones, como en la obra 'Fausto' de Goethe. Personajes famosos con este nombre incluyen a Margarita Teresa, una infanta española del siglo XVII, y la actriz Margarita Salas. En otras lenguas, el nombre tiene variantes como Marguerite en francés, Margherita en italiano y Marga...",Muy fácil,Fácil,"El nombre 'Margarita' es muy fácil de pronunciar para los españoles, ya que contiene fonemas comunes en el idioma, como la 'r' y la 'a'. Para los hablantes de inglés, la pronunciación es considerada fácil, aunque la 'r' puede presentar cierta dificultad. No hay letras mudas ni pronunciaciones no intuitivas. La estructura del nombre es simple, lo que facilita la adaptación fonética, aunque la vibrante 'r' podría ser un pequeño reto para quienes no son hispanohablantes."
MARIA JOSEFA,83234,64.9,Female,0.3756447494829886,60,True,12,5,Otro,"María Josefa es un nombre de origen distinto que combina María, de raíces hebreas, significando 'amada' o 'rebelde', y Josefa, que proviene del hebreo y significa 'Dios añade'. Este nombre compuesto ha sido popular en diversas culturas hispanohablantes, donde a menudo se rinde homenaje a figuras religiosas y culturales. En la historia, María Josefa destaca como un nombre con connotaciones de fortaleza y devoción. Personalidades famosas como María Josefa de Ayala, quien fue una notable escrito...",Muy fácil,Fácil,"Para los españoles, 'María' y 'Josefa' contienen fonemas comunes y fáciles de pronunciar. No hay sonidos problemáticos ni letras mudas. Sin embargo, para hablantes de inglés, la 'j' de 'Josefa' puede ser difícil, ya que el sonido en español es diferente al de la 'j' en inglés, lo que puede presentar un leve desafío. La combinación en 'Maria Josefa' es clara, pero el sonido de la 'j' no es intuitivo para ellos, aunque en general, ambas partes son más accesibles en comparación con nombres más complejos."
CARLA,82477,15.4,Female,0.3722283201949738,61,False,5,2,Otro,"El nombre Carla tiene un origen de significado incierto, aunque se relaciona con el germánico 'karla', que significa 'fuerte' o 'valiente'. En la historia cultural, Carla ha sido un nombre popular en diversos países, especialmente en el ámbito hispanohablante. Entre las referencias culturales, destaca la famosa cantautora española Carla Bruni, quien también fue primera dama de Francia. En otros idiomas, el nombre tiene variantes como Charlotte en francés e inglés, y Karla en alemán. Un dato c...",Muy fácil,Muy fácil,"El nombre 'Carla' utiliza fonemas comunes en español, tales como la 'C' suave y la 'L'. No presenta problemas de pronunciación ni letras mudas. Para los hablantes de inglés, tampoco hay dificultades, ya que la estructura y los sonidos son simples y familiares. No hay fonemas ajenos al español ni peculiaridades en su pronunciación. Por lo tanto, es fácil tanto para españoles como para extranjeros."
EVA,81731,35.3,Female,0.3688615351898761,62,False,3,2,Otro,"Eva es un nombre de origen hebreo que significa 'vida' o 'viviente'. En la tradición bíblica, Eva es conocida como la primera mujer, creada por Dios a partir de una costilla de Adán, lo que la convierte en un símbolo de la maternidad y la fertilidad. Su historia ha trascendido a través de los siglos, inspirando obras literarias, artísticas y cinematográficas. Personajes famosos que llevan este nombre incluyen a la actriz Eva Mendes y la cantante Eva Green. En otros idiomas, variantes del nomb...",Muy fácil,Muy fácil,"El nombre 'Eva' contiene fonemas comunes en español, como 'E' y 'V', que son fácilmente pronunciables. No hay letras mudas ni combinaciones no intuitivas. Para los españoles, la pronunciación es sencilla. Para los hablantes del inglés, 'Eva' es también fácil de pronunciar, ya que sigue una estructura fonética simple y clara. En resumen, no presenta sonidos problemáticos ni diferencias significativas en la dificultad de pronunciación entre españoles y extranjeros."
INMACULADA,77197,47.7,Female,0.3483990643948179,63,False,10,5,Otro,"Inmaculada, de origen latino 'Inmaculatus', significa 'sin mancha' o 'puro'. Este nombre está intrínsecamente relacionado con la devoción a la Inmaculada Concepción, celebrada por la Iglesia Católica el 8 de diciembre, que destaca la pureza de la Virgen María. En el ámbito cultural, Inmaculada ha inspirado diversas obras de arte y literatura, reflejando su importancia en la fe católica. Personajes famosos que llevan este nombre incluyen a Inmaculada González, una notable figura en el ámbito s...",Fácil,Fácil,"El nombre 'Inmaculada' contiene fonemas comunes en español, como la 'I', 'N', 'M', 'A', 'C', 'U', 'L', y 'D', que no presentan dificultad para los hablantes españoles. Para los hablantes de inglés, la pronunciación es clara y se puede adaptar, aunque la doble 'L' y la 'C' pueden ser poco familiares. No hay letras mudas ni pronunciaciones no intuitivas. La dificultad se encuentra en la longitud del nombre más que en su fonética."
MARIA ROSARIO,77073,61.6,Female,0.3478394379328445,64,True,13,5,Otro,"María Rosario es un nombre compuesto que combina María, de origen hebreo que significa 'la elegida' o 'la amada', y Rosario, que proviene del latín 'rosarium', refiriéndose a 'ramo de rosas'. Este nombre tiene un fuerte contexto cultural, especialmente en el ámbito católico, donde se asocia a la Virgen del Rosario. Personajes como María Rosario de Santa Teresa, una figura religiosa, han llevado este nombre a la prominencia en varias comunidades. En otros idiomas, María se traduce como Mary en...",Muy fácil,Fácil,"Para los españoles, 'María Rosario' contiene fonemas comunes y fáciles de pronunciar. No presenta sonidos problemáticos ni letras mudas. Sin embargo, para hablantes de inglés, la combinación del sonido 'rr' en 'Rosario' puede ser un poco complicada, aunque la estructura en general es sencilla. 'María' es un nombre conocido y fácil de pronunciar para ellos. En resumen, 'María' es muy accesible para todos, mientras que 'Rosario' puede requerir algo de práctica para los extranjeros."
MARIA MERCEDES,76337,58.0,Female,0.3445177840940349,65,True,14,5,Otro,"María Mercedes es un nombre compuesto de rica herencia cultural. María, de origen hebreo, significa 'la que es amada' o 'la elegida'. Mercedes, por su parte, proviene del español, vinculado a la Virgen de las Mercedes, cuyo nombre se traduce como 'misericordia' o 'compasión'. Juntas, evocan un sentido de amor y protección. En la cultura popular, María Mercedes es el título de una famosa telenovela mexicana de los años 90, lo que contribuyó a su popularidad en el mundo hispanohablante. Variant...",Muy fácil,Fácil,"Para los españoles, 'María' y 'Mercedes' contienen fonemas comunes y son fáciles de pronunciar. No hay letras mudas ni pronunciaciones no intuitivas. Para los extranjeros, 'María' es fácil debido a su sonoridad simple, mientras que 'Mercedes' puede presentar cierta dificultad por el sonido de la 'c' (que en este caso se pronuncia como 's' en lugar de 'k'). Sin embargo, la combinación de sonidos no es compleja, lo que mantiene la evaluación en la categoría de fácil."
ANA ISABEL,76092,47.1,Female,0.3434120705199747,66,True,10,5,Otro,"Ana Isabel es un nombre compuesto que combina Ana, de origen hebreo, que significa 'gracia', y Isabel, de raíces en el hebreo y el español, que se traduce como 'Dios es mi juramento'. Este nombre ha sido popular en diversas culturas, especialmente en el ámbito hispanohablante. La figura de Isabel ha sido representada en la historia, destacando reinas como Isabel I de Inglaterra y la Reina Isabel de España. En su forma variante, encontramos nombres como Anne en francés y Isabella en italiano. ...",Muy fácil,Muy fácil,"El nombre 'Ana Isabel' se compone de dos nombres comunes en español. 'Ana' es un nombre de fácil pronunciación para cualquier hablante y 'Isabel' contiene fonemas habituales como la 'i' y la 's'. No presenta letras mudas ni combinaciones poco comunes en español. Para hablantes de inglés, ambos nombres son igualmente sencillos y no contienen sonidos problemáticos, por lo que la pronunciación es directa y clara para ambos grupos."
NOELIA,74133,31.3,Female,0.3345708750441213,67,False,6,2,Otro,"Noelia es un nombre de origen diverso que se asocia comúnmente con el significado de 'nacimiento' o 'nacida en Navidad', pues se relaciona con la festividad del 25 de diciembre. Este nombre ha sido utilizado en varias culturas, especialmente en países de habla hispana. En la cultura popular, Noelia ha sido objeto de canciones y obras literarias, resaltando su belleza y complejidad. Destacan algunas figuras públicas con este nombre, como la cantante Noelia, famosa en el ámbito de la música lat...",Muy fácil,Fácil,"El nombre 'Noelia' presenta fonemas comunes en español, como la 'N', 'O', 'E', 'L' e 'I', lo que lo hace muy fácil de pronunciar para los hablantes nativos. Sin embargo, para hablantes de inglés, aunque la pronunciación es clara, la combinación de las vocales y la 'L' puede no ser tan intuitiva, lo que lo clasifica como fácil. No hay letras mudas ni pronunciaciones no intuitivas. No es un nombre compuesto, lo que simplifica aún más su evaluación."
ESTHER,73274,44.3,Female,0.3306941078599671,68,False,6,2,Otro,"Esther es un nombre de origen persa que significa 'estrella'. En la historia bíblica, Esther es la heroína del Libro de Ester, donde se convierte en reina y salva a su pueblo de la amenaza de exterminio. Este nombre se ha mantenido popular a lo largo de los siglos, utilizado en diversas culturas con un significado similar. En la literatura, hay personajes como Esther Greenwood, de 'La campana de cristal' de Sylvia Plath. Su variante en inglés es también Esther, y en francés se utiliza Estelle...",Fácil,Fácil,"El nombre 'Esther' contiene fonemas comunes en español, por lo que es fácilmente pronunciable para los hablantes de español. La 'th' se pronuncia como 't', lo que simplifica la adaptación. Para los hablantes de inglés, la pronunciación es igualmente clara, ya que no presenta sonidos típicos del español como la 'ñ' o la 'rr'. No hay letras mudas ni pronunciaciones poco intuitivas, lo que ayuda a su facilidad de pronunciación en ambos idiomas."
VERONICA,71776,37.0,Female,0.3239334591499987,69,False,8,4,Otro,"Veronica es un nombre de origen latino, derivado de 'Vera Icona', que significa 'verdadera imagen'. En el contexto cultural, se asocia con la figura de Santa Verónica, quien, según la tradición cristiana, limpió el rostro de Jesucristo durante su camino al Calvario. Este nombre ha sido popular en diversas culturas, siendo utilizado en la literatura y el arte. Personajes famosos como Veronica Lake, una icónica actriz de Hollywood, han llevado el nombre a la pantalla grande. En otros idiomas, V...",Fácil,Fácil,"Para los españoles, 'Veronica' presenta fonemas comunes, aunque la combinación de 'V' y 'R' puede ser menos habitual. No hay letras mudas ni pronunciaciones no intuitivas. Para extranjeros, particularmente angloparlantes, la pronunciación es clara y sencilla, sin sonidos difíciles como el 'ñ' o la 'rr'. Sin embargo, pueden tener cierta dificultad con la 'V', que se pronuncia diferente en español. En general, 'Veronica' es accesible tanto para españoles como para extranjeros."
DANIELA,68928,15.4,Female,0.3110801029911267,70,False,7,3,Otro,"Daniela es un nombre de origen hebreo que significa 'Dios es mi juez'. Ha sido ampliamente utilizado en diversas culturas, siendo especialmente popular en países de habla hispana. Su variante en inglés es Danielle, que mantiene el mismo significado. A lo largo de la historia, Daniela ha sido un nombre asociado con personalidad fuerte y determinación, y ha sido llevado por diversas figuras notables, como la famosa actriz Daniela Ruah y la escritora Daniela de Souza. Un dato curioso es que,...",Muy fácil,Fácil,"Para los españoles, 'Daniela' contiene solo fonemas comunes y no presenta dificultades de pronunciación. Sin embargo, para hablantes de inglés, puede ser un poco más complicado debido al sonido de la 'D', que puede ser pronunciado más suave en su lengua nativa. No hay letras mudas ni pronunciaciones no intuitivas. En conclusión, la dificultad es mayor para extranjeros, ya que 'Daniela' no es un nombre de uso tan común en inglés."
NEREA,67687,21.6,Female,0.3054793252547643,71,False,5,2,Otro,"Nerea es un nombre de origen griego que significa 'la que viene del mar' o 'mujer del mar'. En la mitología griega, Nerea era un dios marino, símbolo de la profundidad y la sabiduría del océano. Este nombre ha sido adoptado en diversas culturas y cuenta con variantes en otros idiomas, como Nereida en español o Nerey en catalán. Es un nombre popular en países de habla hispana y ha ganado popularidad en la literatura y la música. Un dato curioso es que Nerea también está asociada a las ninfas d...",Fácil,Fácil,"El nombre 'Nerea' contiene únicamente fonemas comunes en español, como la 'e' y la 'r', los cuales son fáciles de pronunciar. Para los hablantes de español, no presenta sonidos problemáticos ni letras mudas. Para los hablantes de inglés, la pronunciación también es clara y sencilla, sin ningún sonido español específico que complique la fonética. En resumen, tanto para españoles como para extranjeros, 'Nerea' es accesible en términos de pronunciación."
