Nombre,Frecuencia,Edad Media (*),Gender,Percentage,Popularity,Is_Compound,Character_Count,Syllable_Count,Family_Origin,Name_Description,Pronunciation_Spanish,Pronunciation_Foreign,Pronunciation_Explanation
MARIA LUISA,151913,63.6,Female,0.6856010864335399,24,True,11,4,Otro,"María Luisa es un nombre compuesto que combina dos elementos: María, de origen hebreo, que significa 'señora' o 'madre', y Luisa, de origen germano, que significa 'guerrera famosa'. Este nombre ha sido popular en diversas culturas, especialmente en países hispanohablantes, y su uso se ha mantenido constante a lo largo de los años. María Luisa ha sido llevado por figuras destacadas como María Luisa de Borbón, una reina consorte de Francia, y María Luisa de Orléans, un símbolo de la cultura e...",Muy fácil,Fácil,"Para los españoles, el nombre 'María Luisa' utiliza fonemas comunes como la 'm', 'a', 'r', 'i', y 'l', lo que lo hace muy fácil de pronunciar. Para los hablantes de inglés, la combinación 'Luisa' puede causar confusión con la 'u' y la pronunciación de la 's', aunque no presenta sonidos difíciles específicos del español. No hay letras mudas ni pronunciaciones no intuitivas. El análisis de las partes sugiere que ambas son igualmente fáciles para los españoles y solo ligeramente más complejas para los extranjeros."
RAQUEL,147490,39.6,Female,0.6656395715842804,25,False,6,2,Otro,"Raquel es un nombre de origen hebreo que significa 'oveja' o 'cordero', simbolizando ternura y docilidad. En la tradición bíblica, Raquel es una figura importante; es la segunda esposa de Jacob y madre de José y Benjamín, lo que le otorga un lugar destacado en la historia del pueblo hebreo. Culturalmente, el nombre ha sido popular en diversas partes del mundo, especialmente en comunidades hispanohablantes. Entre las variantes en otros idiomas, destacan Rachel en inglés y Rachael en hebreo. Ra...",Muy fácil,Fácil,"Para los españoles, 'Raquel' contiene solo fonemas comunes, por lo que su pronunciación es muy accesible. Para los extranjeros, aunque el nombre es más sencillo que otros, la 'R' inicial puede resultar difícil debido a su pronunciación vibrante, pero al ser un nombre común, es fácil de adaptar. No hay letras mudas ni pronunciaciones no intuitivas, lo que contribuye a su facilidad en ambos contextos. No es un nombre compuesto, por lo que se evalúa como una sola unidad."
ROSA MARIA,145760,55.8,Female,0.6578318798164262,26,True,10,4,Otro,"Rosa María es un nombre compuesto que une dos elementos con significados profundos. 'Rosa' proviene del latín 'Rosa', que simboliza la belleza y el amor, mientras que 'María' tiene raíces hebreas y significa 'la elegida' o 'la señora'. Este nombre es muy popular en culturas hispanohablantes, donde ha sido utilizado en diversas épocas y contextos, destacando en la religión católica por su asociación con la Virgen María. Personalidades como Rosa María Calaf, periodista destacada, han llevado es...",Muy fácil,Fácil,"El nombre 'Rosa Maria' es muy fácil para españoles, ya que ambos nombres contienen fonemas comunes y no presentan sonoridades complejas. Para los hablantes de inglés, 'Rosa' puede requerir ajuste en la pronunciación, aunque 'Maria' es un nombre internacional. No hay letras mudas ni sonidos difíciles; la 'R' en 'Rosa' y 'Maria' es la única particularidad, pero es adaptativa. En general, la dificultad varía, siendo más accesible para los españoles por la familiaridad con estos sonidos."
MANUELA,137035,61.1,Female,0.6184549372299943,27,False,7,3,Otro,"Manuela es un nombre de origen hebreo que significa 'Dios está con nosotros'. Históricamente, ha sido un nombre popular en culturas de habla hispana, asociado con la tradición y la espiritualidad. En la literatura, Manuela ha sido representada en novelas y obras de teatro, siendo un ejemplo notable la protagonista de 'La Casa de los Espíritus' de Isabel Allende. Variantes del nombre incluyen Emmanuelle en francés y Manon en ciertas zonas. Un dato curioso es que el Día de Manuela se celebra el...",Muy fácil,Fácil,"El nombre 'Manuela' contiene fonemas comunes en español, como la 'm', 'a', 'n', 'u', 'e', y 'l', lo que lo hace muy fácil de pronunciar para los hablantes de español. Para los hablantes de inglés, la pronunciación es clara, aunque la 'u' y la 'a' pueden no ser intuibles para todos, pero en general es fácil. No hay letras mudas ni sonidos problemáticos significativos y las dificultades son menores en comparación con nombres que tienen características más complejas."
MARIA JESUS,134467,58.5,Female,0.6068652537271911,28,True,11,4,Otro,"María Jesús es un nombre compuesto de profunda resonancia cultural y religiosa. Su primera parte, María, proviene del hebreo 'Miryam', que se interpreta como 'la elegida' o 'la amada'. Jesús, en árabe 'Isa', significa 'salvador' y es un nombre fundamental en la tradición cristiana. Este nombre refleja una conexión significativa con la figura de la Virgen María y Jesucristo, siendo muy popular en países de habla hispana. En la cultura popular, se encuentra en personajes históricos y contemporá...",Muy fácil,Fácil,"El nombre 'María' es de pronunciación sencilla y familiar en español, sin fonemas problemáticos. 'Jesús' tiene un sonido 'j' suave, que puede ser menos familiar para angloparlantes, aunque es común en nombres españoles. No hay letras mudas ni pronunciaciones complicadas. Para españoles, ambos nombres son fáciles; para extranjeros, la 'j' en 'Jesús' puede presentar un pequeño reto, pero en general, la pronunciación es clara con pocas peculiaridades."
PILAR,133695,65.1,Female,0.6033811276897442,29,False,5,2,Otro,"El nombre Pilar, de origen latino, significa 'piedra' o 'soporte', evocando la idea de fortaleza y estabilidad. En la cultura hispánica, Pilar también se asocia con la Virgen del Pilar, una importante figura religiosa en España y América Latina, lo que le otorga un significado especial para muchas familias. Este nombre es popular en países de habla hispana, pero también tiene variantes en otros idiomas, como 'Bilia' en italiano y 'Pilar' en inglés. Entre los personajes famosos que llevan este...",Muy fácil,Muy fácil,"El nombre 'Pilar' contiene fonemas comunes en español, como las letras 'P', 'I', 'L' y 'R', que se pronuncian tal como se escriben. No hay letras mudas ni pronunciaciones no intuitivas. Para los hablantes de inglés, 'Pilar' también se pronuncia de manera sencilla, ya que los sonidos son similares y no presentan dificultades. Por tanto, se considera fácil para ambos grupos, a pesar de que algunos podrían pronunciarlo como 'Pee-lar' dependiendo de su familiaridad con el español."
CONCEPCION,133195,67.8,Female,0.6011245693753354,30,False,10,3,Otro,"Concepción es un nombre de origen español que hace referencia a la 'Concepción Inmaculada de María', una festividad cristiana que celebra el hecho de que la Virgen María fue concebida sin pecado original. Esta festividad tiene profundas raíces en la cultura hispánica y se asocia con la pureza y la gracia. A lo largo de la historia, ha sido común en países de tradición católica, generando variantes como Concepción en español, Conception en inglés, y Concepción en otros idiomas. Este nombre ha ...",Fácil,Difícil,"Para los españoles, 'Concepcion' contiene fonemas comunes, aunque la 'C' y 'S' en ciertas posiciones pueden generar confusión. Para los hablantes de inglés, la presencia de la 'ción' (sonido similar a 'shun') puede ser complicada, además de la 'C' que suena como 's' en lugar de 'k'. No hay letras mudas ni pronunciaciones no intuitivas para los españoles, pero los extranjeros pueden encontrar dificultad traduciendo estos sonidos a su fonética."
MERCEDES,128179,63.2,Female,0.5784867763651873,31,False,8,3,Otro,"Mercedes es un nombre de origen español que proviene del término 'misericordia', haciendo referencia a la Virgen de las Mercedes, una figura venerada en la cultura hispana. Desde su origen, ha estado asociado a la bondad y el amor maternal. En la historia, Mercedes ha sido el nombre de varias figuras notables, como la actriz Mercedes Sosa, un ícono de la música folclórica argentina. Se encuentra en variantes como Mercè en catalán y Mersede en provenzal. Un dato curioso es que el nombre Merced...",Fácil,Fácil,"El nombre 'Mercedes' es fácil de pronunciar para españoles, ya que contiene fonemas comunes y no presenta sonidos problemáticos. Para extranjeros, también es fácil, pues su pronunciación es clara y no presenta peculiaridades españolas significativas. No hay letras mudas ni pronunciaciones no intuitivas en este nombre. En ambos casos, la combinación de sílabas es simple y familiar, lo que evita confusiones. No se trata de un nombre compuesto, por lo que se evalúa como un solo elemento."
JULIA,127083,38.5,Female,0.5735404005400034,32,False,5,2,Otro,"Julia es un nombre de origen incierto, pero se ha popularizado en diversas culturas. Etimológicamente, se relaciona con el término latino 'Julius', que significa 'dedicado a Júpiter'. A lo largo de la historia, Julia ha sido un nombre noble, mencionado en las obras de autores romanos. En la cultura popular, destaca Julia Roberts, reconocida actriz estadounidense, y Julia Child, innovadora chef que llevó la cocina francesa a América. Sus variantes incluyen Juliana en español y Giulia en italia...",Muy fácil,Fácil,"El nombre 'Julia' presenta fonemas comunes en español, como la 'J' que se pronuncia como una vocal suave y la 'U' que es clara. Para los españoles, no hay sonidos problemáticos ni letras mudas, resultando en una pronunciación intuitiva. Para los extranjeros, la 'J' puede ser confusa, ya que en inglés suena más como una 'Y', pero en general, 'Julia' sigue siendo accesible y fácil de pronunciar. No es un nombre compuesto, por lo que la evaluación se centra únicamente en una parte."
BEATRIZ,122687,40.6,Female,0.553700739839722,33,False,7,2,Otro,"Beatriz es un nombre de origen incierto, aunque se asocia principalmente con el término latino 'beatus', que significa 'bendita' o 'afortunada'. A lo largo de la historia, Beatriz ha sido un nombre popular en diversas culturas, evocado en obras literarias como 'La Divina Comedia' de Dante Alighieri, donde Beatriz es la musa y guía del poeta. Además, figuras notables como Beatriz de Este, una noble italiana del Renacimiento, han contribuido a su popularidad. Internacionalmente, Beatriz tiene v...",Muy fácil,Fácil,"El nombre 'Beatriz' presenta sonidos comunes en español, por lo que es muy fácil para los hablantes nativos. La combinación de fonemas es intuitiva y no contiene letras mudas ni pronunciaciones complejas. Sin embargo, para hablantes de inglés, puede ser algo menos común debido a la 'tr' que no aparece frecuentemente al inicio de las sílabas, lo que lo convierte en fácil aunque no tan directo pues podrían pronunciarlo como 'Bee-uh-triz'."
ALBA,122286,19.3,Female,0.5518909800715663,34,False,4,2,Otro,"Alba es un nombre de origen latino que significa 'amanecer' o 'blanco', evocando la belleza de un nuevo comienzo. A lo largo de la historia, ha sido utilizado en diversas culturas, simbolizando la esperanza y la luz. En la literatura y el cine, personajes como Alba de 'La Casa de los Espíritus' de Isabel Allende han dejado huella, mostrando la conexión del nombre con la fuerza femenina. En otros idiomas, Alba se traduce directamente como 'Dawn' en inglés y 'Aube' en francés, manteniendo su si...",Muy fácil,Muy fácil,"El nombre 'Alba' no presenta fonemas problemáticos para hablantes españoles, ya que está compuesto únicamente por sonidos comunes en el idioma (A, L, B). Para los hablantes de inglés, también es fácil de pronunciar, pues no tiene combinaciones complicadas y su estructura es clara. No hay letras mudas ni pronunciaciones no intuitivas, lo que contribuye a su facilidad en ambos idiomas."
SILVIA,120320,39.5,Female,0.5430181927793112,35,False,6,2,Otro,"El nombre Silvia tiene un origen latín, derivado de 'silva' que significa 'bosque' o 'selva'. A lo largo de la historia, Silvia ha sido un nombre popular en diversas culturas, asociado a la naturaleza y la fertilidad. En la literatura, destaca Silvia como un personaje en 'El sueño de una noche de verano' de William Shakespeare, donde representa la belleza y el amor. Variantes de este nombre pueden encontrarse en otros idiomas como Silvie en francés y Silvana en italiano. Un dato curioso es qu...",Muy fácil,Fácil,"El nombre 'Silvia' contiene fonemas comunes en español, como la 'S', 'I', 'L', 'V' y 'A', lo que lo hace muy fácil de pronunciar para hablantes nativos. Para extranjeros, aunque la 'V' puede ser un poco confusa, en general la pronunciación es sencilla y no hay letras mudas ni pronunciaciones no intuitivas. La principal dificultad puede surgir de la adaptación de la 'V', que tiene sonidos menos comunes en inglés, aunque no es un obstáculo significativo."
NURIA,119880,41.0,Female,0.5410324214626316,36,False,5,2,Otro,"Nuria es un nombre de origen incierto, pero se ha asociado con la palabra árabe que significa 'luz'. Este nombre tiene una rica historia cultural en la región del Mediterráneo, especialmente en España, donde está vinculado a la legendaria figura de la Virgen de Nuria, venerada en un santuario en los Pirineos. En el ámbito cultural, Nuria ha sido utilizado en obras literarias y musicales, destacándose como un símbolo de belleza y espiritualidad. Hay variantes del nombre en diferentes idiomas, ...",Muy fácil,Fácil,"El nombre 'Nuria' presenta sólo fonemas comunes para los hablantes españoles, making it very easy to pronounce. Sin embargo, para los extranjeros, especialmente para los hablantes de inglés, la combinación de 'N' y 'R' puede resultar un poco menos intuitiva, ya que la 'R' no se pronuncia de la misma manera en inglés como en español. No hay letras mudas ni sonidos complejos que compliquen su pronunciación. En resumen, es más fácil para los españoles que para los extranjeros, pero sigue siendo manejable."
IRENE,117979,28.7,Female,0.5324529867512497,37,False,5,3,Otro,"Irene es un nombre de origen griego que significa 'paz'. Ha sido un nombre popular en diversas culturas y su significado refleja un deseo universal por la armonía. En la historia, Irene fue una emperatriz bizantina del siglo VIII, famosa por sus intentos de promover la paz en el imperio. En la cultura popular, se destaca la figura de Irene Adler, un personaje de Arthur Conan Doyle, conocido por ser la única mujer que logró impresionar a Sherlock Holmes. Variantes del nombre en otros idiomas i...",Muy fácil,Fácil,"El nombre 'Irene' contiene fonemas comunes en español, por lo que es muy fácil de pronunciar para los españoles. Para hablantes de inglés, la pronunciación es clara, aunque la combinación 'RENE' puede resultar algo menos familiar. No hay letras mudas ni pronunciaciones no intuitivas. La dificultad para extranjeros radica en que deben adaptarse a una pronunciación que incluye la 'I' y la 'R' española, pero en general, es un nombre accesible."
PATRICIA,112197,35.3,Female,0.5063581464034274,38,False,8,3,Otro,"Patricia es un nombre de origen incierto, aunque se asocia comúnmente con el latín 'patricius', que significa 'noble' o 'de la nobleza'. A lo largo de la historia, ha sido un nombre popular en diversas culturas, simbolizando prestigio y honor. En la cultura occidental, Patricia se popularizó especialmente en los siglos XX y XXI. Algunos personajes famosos llevan este nombre, como la actriz Patricia Arquette y la escritora Patricia Highsmith. En otras lenguas, tiene variantes como Patricia en ...",Muy fácil,Fácil,"Para los españoles, 'Patricia' contiene fonemas comunes y no presenta sonidos problemáticos. Para los hablantes de inglés, la pronunciación es clara, aunque la 'C' suave puede ser menos intuitiva. No hay letras mudas ni pronunciaciones complejas. La dificultad es mayor para extranjeros debido a la adaptación de sonidos españoles, aunque 'Patricia' se considera accesible. En resumen, es un nombre fácil en ambos contextos, pero con matices en la familiaridad de los fonemas."
ROSARIO,110715,65.8,Female,0.49966970755952,39,False,7,3,Otro,"Rosario es un nombre de origen latino que significa 'ramo de rosas' o 'rosal'. Su uso está profundamente arraigado en la tradición cristiana, especialmente en referencia a la Virgen María del Rosario, que simboliza la devoción y la espiritualidad. A lo largo de la historia, el nombre ha sido popular en diversas culturas, especialmente en países de habla hispana, donde se asocia a festividades y tradiciones religiosas. Entre los personajes célebres que llevan este nombre se encuentra Rosario D...",Muy fácil,Fácil,"El nombre 'Rosario' contiene fonemas comunes en español, como la 'R' y la 'O', lo que lo convierte en muy fácil de pronunciar para los hablantes españoles. Sin embargo, para hablantes de inglés, la 'R' inicial y la 'S' combinada con la 'A' pueden presentar ligera dificultad, pero en general, la pronunciación es clara y accesible. No hay letras mudas ni pronunciaciones intuitivas complicadas que dificulten el nombre."
JUANA,109340,67.7,Female,0.4934641721948961,40,False,5,2,Otro,"Juana es un nombre de fuerte carga cultural, con un significado que se asocia comúnmente a 'Dios es misericordioso'. Su origen se conecta a la tradición judeocristiana, siendo un nombre muy popular en España y América Latina. A lo largo de la historia, Juana ha sido portado por figuras icónicas como Juana de Arco, una heroína nacional en Francia, y Juana I de Castilla, conocida como Juana la Loca. En otros idiomas, encontramos variantes como Jane en inglés y Giovanna en italiano. Un dato curi...",Muy fácil,Fácil,"El nombre 'Juana' presenta fonemas exclusivamente españoles, por lo que es muy fácil de pronunciar para hablantes de español. Para los hablantes de inglés, la 'J' puede ser un sonido problemático, ya que suena como una 'h' en inglés, pero la estructura general del nombre sigue siendo clara y sencilla. No hay letras mudas ni pronunciaciones no intuitivas en el nombre. En resumen, 'Juana' es accesible para españoles y ligeramente menos familiar para extranjeros, aunque sigue siendo fácil."
ROCIO,109029,31.8,Female,0.4920605929233339,41,False,5,2,Otro,"Rocío es un nombre de origen español que significa 'rocío' en referencia a las gotas de agua que se depositan sobre las plantas durante la noche. Este nombre evoca frescura y renovación, simbolizando la belleza de la naturaleza. Culturalmente, Rocío es común en España y es también asociado con la famosa romería del Rocío en Andalucía, una fiesta que celebra la devoción a la Virgen del Rocío, atrayendo a miles de peregrinos cada año. Entre las figuras destacadas con este nombre se encuentra Ro...",Muy fácil,Fácil,"El nombre 'Rocio' contiene fonemas comunes en español, como la 'R' inicial y las vocales 'O' e 'I'. Para los españoles, la pronunciación es intuitiva. Sin embargo, para los hablantes de inglés, la 'R' inicial y la 'C' podrían ser un poco más difíciles de pronunciar, aunque no presentan peculiaridades extremas. No hay letras mudas ni pronunciaciones no intuitivas en este caso. En resumen, 'Rocio' es fácil para los hispanohablantes y algo más complicado para angloparlantes, pero todavía accesible."
ANDREA,108829,25.4,Female,0.4911579695975703,42,False,6,2,Otro,"Andrea es un nombre de origen griego que significa 'valiente' o 'hombre' en su forma masculina, Andrés. Con una rica historia cultural, ha sido popular en diversas tradiciones a lo largo de los siglos, utilizado en países de habla hispana, italiana y otros. En la literatura, destaca la figura de Andrea del Sarto, un pintor del Renacimiento italiano, y en la música, Andrea Bocelli es un famoso tenor contemporáneo. Las variantes del nombre incluyen André en francés y Andreas en alemán. Un dato ...",Muy fácil,Fácil,"El nombre 'Andrea' no presenta fonemas problemáticos para los hispanohablantes, ya que todos los sonidos son comunes. Sin embargo, para hablantes de inglés, la combinación de vocales y el acento pueden ser ligeramente menos intuitivos, clasificándolo como fácil. No hay letras mudas y la pronunciación sigue patrones familiares. Además, la 'A' y la 'E' son sencillas de pronunciar en ambos idiomas, lo que reduce la complejidad en comparación con nombres que incluyen sonidos exclusivos del español."
TERESA,107840,62.9,Female,0.4866944972516699,43,False,6,3,Otro,"Teresa es un nombre de origen incierto, a menudo relacionado con el griego 'Thera', que significa 'cosecha'. En la historia cultural, Santa Teresa de Jesús se destaca como una figura clave en la Reforma Carmelitana del siglo XVI, representando la devoción y la espiritualidad dentro del catolicismo. Entre personajes famosos, encontramos a Teresa de Calcuta, quien dedicó su vida a ayudar a los más necesitados. En diferentes idiomas, el nombre se presenta como Terese en francés, Teresa en italia...",Muy fácil,Muy fácil,"El nombre 'Teresa' contiene fonemas comunes en español, como la T, E, R, S y A, que son fáciles de articular. No hay letras mudas ni pronunciaciones no intuitivas. Para los hablantes de español, 'Teresa' es simple y directo, mientras que para los extranjeros, especialmente angloparlantes, también resulta fácil debido a su estructura y sonidos familiares. No presenta dificultad en comparación con otras palabras que tengan sonidos específicos del español."
ENCARNACION,106748,65.4,Female,0.4817661738930013,44,False,11,4,Otro,"El nombre Encarnacion proviene del latín 'incarnatio', que significa 'encarnación'. Este término hace referencia a la idea de tomar forma o cuerpo, y tiene profundas connotaciones religiosas, especialmente en la tradición cristiana donde se celebra la Encarnación de Cristo. Culturalmente, es un nombre muy valorado en países hispanohablantes, evocando un sentido de divinidad y espiritualidad. Aunque no se asocia a personajes famosos de manera prominente, tiene un lugar significativo en la lite...",Fácil,Difícil,"Para los españoles, 'Encarnacion' contiene fonemas comunes, aunque la combinación de 'ci' puede ser menos habitual. Para los extranjeros, la 'ñ' y la 'ci' presentan dificultades, ya que estos sonidos específicos del español no tienen equivalentes fáciles en inglés. Además, la estructura del nombre puede ser confusa. No hay letras mudas ni pronunciaciones intuitivas que dificulten aún más la pronunciación para quienes no hablan español."
MONTSERRAT,106395,57.2,Female,0.4801730437230287,45,False,10,3,Otro,"Montserrat es un nombre de origen catalán que proviene de la montaña del mismo nombre, famosa por su monasterio benedictino y su veneración a la Virgen de Montserrat. Etimológicamente, el término 'Montserrat' significa 'monte serrado', haciendo referencia a la forma de sus picos. En el ámbito cultural, Montserrat es un lugar sagrado y un símbolo de identidad para muchos catalanes. La música también le rinde homenaje, como lo demuestra la popularidad del 'Himno de Montserrat'. En el ámbito int...",Fácil,Difícil,"Para los españoles, 'Montserrat' presenta fonemas comunes; sin embargo, la combinación de 'tt' puede resultar menos habitual. Para los hablantes de inglés, la presencia de la letra 'rr' no existe en su fonética, así como la terminación 'at', lo que complica la pronunciación. No hay letras mudas, pero la estructura puede llevar a confusión para extranjeros. No es un nombre compuesto, por lo que se evalúa en su totalidad."
MONICA,103164,41.3,Female,0.4655911638953197,46,False,6,3,Otro,"Mónica es un nombre de origen incierto, aunque se asocia comúnmente con el término griego 'monikos', que significa 'solitaria' o 'única'. A lo largo de la historia, Mónica ha sido un nombre prominente en diversas culturas, particularmente en el cristianismo, siendo famosa Santa Mónica, la madre de San Agustín, quien es considerada un símbolo de devoción y perseverancia. En la cultura popular, Mónica ha sido representada en series de televisión como 'Friends', a través del personaje de Mónica ...",Muy fácil,Fácil,"El nombre 'Monica' es fácil de pronunciar para los españoles, ya que contiene fonemas comunes en el idioma. No tiene letras mudas ni pronunciaciones complejas. Para los hablantes de inglés, la pronunciación es clara, aunque la 'C' en 'Monica' puede causar confusión, ya que en español se pronuncia como una 'K'. Esta letra no es problemática para los españoles, pero sí podría ser menos intuitiva para los extranjeros. En resumen, mientras que es muy accesible para los españoles, presenta una leve dificultad para los hablantes de inglés."
ALICIA,100728,40.4,Female,0.4545972117875205,47,False,6,3,Otro,"Alicia es un nombre de origen incierto, aunque se le asocia frecuentemente con el significado 'noble' o 'de la nobleza'. Este nombre ganó popularidad en la literatura gracias a la obra 'Alicia en el País de las Maravillas' de Lewis Carroll, un clásico que ha influenciado la cultura popular y ha inspirado diversas adaptaciones en cine y teatro. Alicia es un nombre ampliamente utilizado en distintos idiomas, con variantes como Alice en inglés, Alix en francés y Alica en checo. Un dato curioso e...",Muy fácil,Fácil,"El nombre 'Alicia' tiene fonemas comunes en español, como la 'A', 'L', 'I', 'C' y 'A', que lo hacen muy fácil de pronunciar para los hispanohablantes. Para los extranjeros, aunque la pronunciación es clara, la 'C' antes de 'I' podría resultar confusa, ya que podría interpretarse como un sonido 's' en español; sin embargo, sigue siendo más fácil que otros nombres. No hay letras mudas ni pronunciaciones no intuitivas en ninguna de las versiones."
